name,description,instructor,rating,reviews,total_hours,num_of_lectures,difficulty,price,badge
Flask Landing - Learn the Python Microframework,Learn Flask Step by Step through Building a Live a Landing Page with Flask and Python 3.6,Justin Mitchel,5.0,11,4 total hours,55,Beginner,149000,Highest rated
"CSS3 Animations, Transforms and Transitions Ultimate Guide","Enhance User Experience, Interactive Pages, 3D Animations, Real-Life Projects and Best Practices with CSS3 Animations",Alperen Talaslıoğlu,5.0,5,7.5 total hours,93,All Levels,149000,Hot & new
JavaScript 5 Projects JS Dynamic interactive DOM elements,Perfect to practice and learn more about JavaScript and DOM interactions create useful components and more,Laurence Svekis,5.0,1,7.5 total hours,72,All Levels,149000,-
"HTML, CSS and JavaScript - Complete Guide For Beginners","This is a complete guide for web development beginners interested in learning HTML, CSS, & JavaScript ( JS ).",Oak Academy,5.0,3,12 total hours,99,All Levels,149000,-
JavaScript with Real World App Project,"Start JS from scratch, learn JavaScript libraries such as React, Angular, Node with hands-on projects with JavaScript!","Oak Academy, Muhammet Gokturk",5.0,16,9 total hours,70,All Levels,149000,Highest rated
Build a WordPress plugin instead of using theme's functions,Learn to build your own custom plugins and how you can add codes to it avoid using functions.php,Saujan Man Pradhan,5.0,1,37 total mins,9,Intermediate,149000,-
Build an Online Paint Website,Learn Web Development Essentials and Become a Web Developer From Scratch,"Mammoth Interactive, John Bura",5.0,1,11.5 total hours,133,All Levels,149000,-
CSS Flexbox Challenge: Build a Responsive Website in 1 Hour.,CSS Flexbox is great for building responsive websites. A screencast that will help you to create website faster.,Coder Champ,5.0,1,1 total hour,15,All Levels,149000,-
Learn Javascript The Right Way,Get In depth Understanding of JavaScript,Bhanu prathap,5.0,1,35 total mins,5,Beginner,149000,-
How to Make an eCommerce Website in WordPress in 2021,"Make an eCommerce Store using WordPress, WooCommerce, Elementor and WoodMart Theme",Md Zaman,5.0,2,3 total hours,24,Beginner,149000,New
Implement Most In-demand JavaScript Projects for Interviews,Build Real-world and Essential Projects Every Recruiters Look for!,Avinash Verma,5.0,2,1.5 total hours,5,All Levels,149000,New
Create a Wix Website and Blog From Scratch,Create a website and blog with Wix using a blank template.,David Utke,5.0,1,1.5 total hours,16,Beginner,149000,-
Modern JavaScript Bootcamp - Beginner To Advanced,Learn Modern JavaScript from the beginning to Advanced concepts. Build several real world JavaScript projects/apps.,Ewomazino Akpareva,5.0,3,19 total hours,110,All Levels,149000,New
Vue.JS Crash Course + Guide,"Modern Front End Web Development Framework Vue JS complete course-Components, Single Page Applications, Forms & more ...",Mayank Chaudhari,5.0,8,12.5 total hours,68,Intermediate,149000,-
WooCommerce Tutorial - Make a Professional Online Store,Learn how to create an online store with WordPress and WooCommerce,David Utke,5.0,1,2.5 total hours,21,Intermediate,149000,New
Data Driven Framework - Designing and Implementation,A Step-By-Step process to build your own Data Driven Framework in Selenium using Excel Sheets,Hemant M Rathod,5.0,1,3 total hours,6,Intermediate,149000,New
HTML5 for Beginners (2018) Starting place for Web Developers,"With tech rising up into so many industries and careers, now has never been a better time to be a bit more technical!",Jonathan Fernandez,5.0,1,2 total hours,16,Beginner,149000,-
MERN Stack Bootcamp - Zero to Hero in One Course,Master JavaScript React Node MongoDB NextJs SocketIo and Become a Professional MERN Stack Developer from Scratch,Ryan Dhungel,5.0,3,24.5 total hours,174,All Levels,149000,New
Learn how to Integrate Add-on to your CodeIgniter Projects,This is the only course on this platform where you will learn how add-on,Olawuyi Segun Orisunola,5.0,4,4.5 total hours,35,All Levels,149000,-
Build Movie Search Engine Using ReactJS,Learn React the easy way by building a Movies Search Engine,Mustafa Alawi,5.0,1,2.5 total hours,28,Beginner,699000,-
The Complete HTML & CSS Practice Test With Explanations 2020,HTML & CSS Practice Test | Helpful for interviews and exam preparation | All topics of HTML & CSS covered + explanations,Luke's Programming School,5.0,1,-,-,All Levels,149000,-
Angular and Deno: A Practical Guide,"Deno APIs, Angular 10, Typescript, MySQL, OOP, Upload Images, Export CSV",Antonio Papa,5.0,5,8 total hours,76,All Levels,149000,-
Advanced WordPress SetUp - Update step by step,Set Up for Beginners-How to Create Easy WordPress Shop Site,Milos Djordjevic,5.0,2,1 total hour,20,All Levels,149000,-
Django - Full Stack Web Development,Learn to build Python based web applications with Django 3,"Rinkesh S, SplusSecurity b",5.0,1,5 total hours,40,All Levels,149000,-
2HRS-Step-BY-Step: Use Wordpress Gutenberg Editor Like A Pro,"""Finally, Learn How To Use the WordPress Gutenberg Editor...Starting Today""& Learn how to Use React in Gutenberg Editor",Taarush Kane,5.0,1,2.5 total hours,12,All Levels,149000,-
"Master HTML, CSS and Vanilla JS By Building 5 Projects",Become advanced frontend web developer,Michalis Michailidis,5.0,1,11 total hours,73,All Levels,149000,New
React and Node.js Project: Build a Torrent Search Engine,"Build your own Torrent Search Engine with React, Express, MongoDB and Node.js",Kaustubh Sathe,5.0,3,2 total hours,11,Beginner,149000,New
How to Make an Affiliate Marketing Website,Get started with Affiliate Marketing and the Kadence Theme!,David Utke,5.0,1,2 total hours,15,All Levels,149000,New
Exploring JavaScript - Objects & THIS,Objects in JavaScript is the most important feature & a strong understanding will help you create useful code patterns,Meher R Howji,5.0,1,1.5 total hours,13,All Levels,149000,-
Create freelance marketplace website like fiverr in hindi ?,Learn the step-by-step process of building your own freelance marketplace like Fiverr without touching a single line of,Sahid Khan,5.0,2,2.5 total hours,16,All Levels,149000,-
JavaScript Projects DOM Interactive Dynamic web pages,Make your webpages come to life with JavaScript and DOM interaction Loaded with Useful Projects in JavaScript,Laurence Svekis,5.0,1,12 total hours,62,All Levels,149000,New
Restful Routing with Practical Examples,"Understand Restful Routing concept, Work on Real practical examples and Discover online REST APIs",Ahmed Magdy,5.0,4,1 total hour,10,Intermediate,149000,-
The Complete jQuery Course: From Beginner To Advanced!,jQuery for beginners jQuery Exercises Included with Source Code. Create Dynamic Interactive web content jQuery Coding,The Content Boss,5.0,1,1.5 total hours,20,All Levels,149000,-
Complete Bootstrap 5 for Beginners with real world Projects,Master Bootstrap and build real world websites using Bootstrap 5 components with HTML5 semantics elements + CSS3 & SASS,Norbert B. Menyhart,5.0,3,16 total hours,109,All Levels,149000,Hot & new
"Advanced Html,Css,Jade(pug),Materializecss Course",learn a better workflow for web development using my workflow,Yoel fisher,5.0,1,3.5 total hours,34,Intermediate,149000,-
"Deno - The Practical Guide (MVC, SQL, NoSQL, REST API)",Build modern web applications with Deno.js. Get a solid understanding from the ground up.,Donald Latumahina,5.0,4,8.5 total hours,77,All Levels,149000,-
How to publish an ASP.NET CORE 3 SPA web site with FREE SSL,Upload you application using a free SSL certificate in only 10 steps,Jose Freire,5.0,3,1 total hour,11,Intermediate,149000,-
How to create Blogger Blogs with blogger Advanced,Advanced Blogger Blog Information. Take your Blogger Blog to the next level.,Thomas Grant,5.0,2,4.5 total hours,52,Intermediate,149000,-
JavaScript Data Structure and Algorithm Crash Course,Understanding JavaScript Data Structure and Sorting Algorithms,OnlyKiosk Tech,5.0,3,2 total hours,33,Intermediate,149000,-
Top and Best Laravel Admin Panel With Projects,"In this Course, I will demonstrate important Laravel Admin Panel that you must know and regularly use in Laravel app",MillionCourses Learning Solutions,5.0,1,1 total hour,17,All Levels,149000,-
"Build fullstack app with Node.Js, Loopback4, React and Hooks","Modern ways to build full-stack web applications with Node.js, Loopback 4, Typescript, React, Mysql, React Hooks",Haider Malik,5.0,1,8.5 total hours,88,All Levels,149000,-
Gatsby Demystified: A complete course on how Gatsby V3 works,Learn the foundations of Gatsby v3: from GraphQL to Gatsby StaticImage to Netlify CMS and so much more!,"Haydn Adams, BFA",5.0,2,8.5 total hours,126,All Levels,149000,-
"Rank, Map & Chart Covid19 Countries with Next.js","Learn to work with React's Next.js, while combining it with an external API to map, graph & display data about Covid19.",Shane Keenan,5.0,2,2 total hours,10,Beginner,149000,-
Oracle: java EE 7 Practice Test Certification 2021,best practice for Oracle java EE 7 Certification 2021,Zied Zied,5.0,2,-,-,All Levels,149000,-
Asp.Net Core & MERN MEAN stack: Build online course and shop,"Learn how to build online course and shop using React JS, Angular, Node JS, MongoDB, Redux, NgRx, Paypal, Asp.Net Core",Hùng Nguyễn Thế,5.0,1,39.5 total hours,142,All Levels,149000,New
Professional JavaScript,Learn the ins and outs of JavaScript in just 4 hours! Become a professional JavaScript programmer!,Fast & Easy Programming,5.0,2,4 total hours,103,All Levels,149000,-
Magento : Magento Certified Developer practice Tests 2021,best Practice Tests for Magento Developer & Front End Certified Developer Certification 2021,Nawel wawa,5.0,1,-,-,All Levels,149000,-
Building a REST API with Express,Take the power of information into your own hands by building a REST API that you can use for business or for fun!,Daniel Stern,5.0,1,1.5 total hours,14,Intermediate,149000,-
Drupal 8 Learning for Beginners - Drupal Masterclass,The Best Way to Learn Drupal 8 for Beginners. An essential step by step training course mastering Drupal from scratch,Ichsan Kurnia,5.0,1,4.5 total hours,67,Beginner,149000,-
Create Your Own React Live Web Chat Application Zero to Hero,Build React Real Time Chat Application From Beginners Level To Advance Level,Tech CodingCamp,5.0,2,6.5 total hours,27,All Levels,149000,-
NestJS - Building Real Project API From Scratch,Improve your NestJS skills with this series while developing an API for real application,Oleksandr Kocherhin,5.0,13,8 total hours,39,Intermediate,149000,-
Webflow For Beginners Part II: Progress Your Webflow Skills,"My second Webflow course focuses on creating common sections, elements and animations in Webflow aimed at beginners.",Sam Harrison,5.0,1,6 total hours,37,Beginner,149000,New
Vue js And Firebase Full Stack App,Learn The Most Demanding Skill,Modern Programmer,5.0,2,4.5 total hours,27,Beginner,149000,-
[2021] Svelte.js 3.41.0 The Complete Practice Tests SvelteJS,"Know and improve your SvelteJS skill level. Be confident and prepared to any Svelte JS interview, test or certification",Thierry Lechat,5.0,1,-,-,All Levels,149000,-
Vue.js custom Video Player from scratch!,"Learn how to build a professional, custom Video Player with zero struggle! Reveal the secrets of writing quality code!",Sanzhar Mirakhmedov,5.0,3,2.5 total hours,17,Beginner,149000,-
Beginner's Guide to building an E-commerce website,Build an online store with WordPress and Elementor,Margaret Savage,5.0,1,1 total hour,14,Beginner,149000,-
Mongo GoLang Go Python PHP Node React Management Interface,With a 3D React Interface,Zach LaCourse,5.0,2,24.5 total hours,124,All Levels,149000,-
Best WordPress Course - Every Topic Covered Under 5 Hours,"One of the fastest WordPress Courses, Covered all major and additional topics under just 5 hours!",Kritish Chopra,5.0,2,4.5 total hours,24,All Levels,149000,-
JavaScript for Absolute Beginners,Learn all the basic concepts to get into JavaScript development,Ali Abdulrahman,5.0,3,5.5 total hours,91,Beginner,149000,-
Hands-on .NET Web API Documentation with Swagger/OpenAPI,"Documenting ASP.NET Core Web API with Swashbuckle, NSwag, Swagger, and OpenAPI through a step-by-step approach.",Praveenkumar Bouna,5.0,2,3.5 total hours,54,Intermediate,149000,Hot & new
Complete Web Developers Bootcamp - Noob to Pro,Everything you need to know... in ONE course!,Chris Hawkes,5.0,1,17.5 total hours,138,Beginner,149000,-
Java Bootcamp 2021: 10 Web Application Development Projects,"Comprehensive programming Course, Build 10 Real World Projects Using Java JSP, JDBC, Servlets, Swing, Maven, Spring Boot",Engineering .Org.In,5.0,8,18.5 total hours,83,All Levels,149000,New
"Richard Stibbard's ""Practical MySQL""",All the MySQL you need to get you going with working with the database behind a dynamic website.,Richard Stibbard,5.0,25,6.5 total hours,99,All Levels,149000,Highest rated
Application Development with Node.js: 2-in-1,"Build highly scalable, developer-friendly APIs for the modern web",Packt Publishing,5.0,1,6 total hours,80,Intermediate,149000,-
Integrate WebCam Features Into Your Web App Using FREE Codes,"Build a simple web application and integrate webcam features into it using FREE JavaScript, CSS, PHP and MySQL Database",Michael Enyichi Nwuzor,5.0,1,2 total hours,14,All Levels,149000,-
Build a Calculator Web App using Python (Flask),Learn Python's Flask Framework By Creating a Calculator Web App,Mustafa Alawi,5.0,2,2.5 total hours,33,Beginner,699000,-
Bootstrap: One Stop Guide to Bootstrap: 3-in-1,Speed up front-end development and prototyping through real-life examples,Packt Publishing,5.0,1,4 total hours,58,Beginner,149000,-
CSS Grid: The Complete Guide,Learn how to create and use CSS Grids,Sergey Shtyrlov,5.0,3,6 total hours,43,Beginner,149000,-
"Build Result System, Certificate Generator and CBT Using PHP",You will learn how to build complete result processing system with automated certificate system and cbt: 2020,Olawuyi Segun Orisunola,5.0,17,17 total hours,169,All Levels,149000,-
Complete WordPress website course to sell music downloads,Build a WordPress website to sell digital music downloads on autopilot. Beginner to Pro complete WordPress materclass,James Brookes,5.0,3,4.5 total hours,32,All Levels,149000,-
Learn JAMStack,"Build websites that are simpler, faster, and more secure",Tech Vista,5.0,1,3.5 total hours,29,All Levels,149000,-
"Shopify App Development - Vanilla PHP, GraphQL, & REST API","Learn Shopify app development & create Shopify apps using Vanilla PHP, GraphQL, REST API, and more!",Bernard Polidario,5.0,6,7.5 total hours,40,All Levels,149000,New
Start a Professional Blog with WordPress - Step 1 to DONE,"Create a Niche Website with the BaseWP (Free), WordPress and Bluehost",David Utke,5.0,1,1.5 total hours,20,Beginner,149000,-
Innovating with Biomathematics,The challenge of building user-friendly interfaces for computational biology,"Jorge Guerra Pires, Theoretical and Mathematical biology",5.0,1,3 total hours,40,All Levels,149000,-
Vue js 3 - The Practical Guide (2021),Learn how to build user interfaces and web applications with Vue js 3 using options API and composition API,Eding Muhamad Saprudin,5.0,2,7.5 total hours,61,All Levels,149000,New
JavaScript Masterclass: Build Powerful Web App Projects,"Modern HTML5, CSS3, VanillaJS, Bootstrap and JavaScript to build Responsive and Mobile Friendly Web Development project",Pianalytix .,5.0,1,4.5 total hours,50,All Levels,149000,-
Modern HTML CSS Projects-Video Background Glass Morphism CSS,"Modern HTML,CSS Video Background website & Projects| Learn through modern and latest HTML, CSS, Bootstrap Projects 2021.",Abdul Qadeer,5.0,8,5.5 total hours,53,Intermediate,149000,-
RabbitMQ Messaging With Java (Spring Boot) From Zero To Hero,"AMQP, Queue, Exchange, Highly Availability, Clustering, Shovel, Federation, Binding, Asynchronous Messaging, Fanout",Senol Atac,5.0,1,4.5 total hours,54,All Levels,149000,Hot & new
Ruby on Rails 5 Masterclass: Build Ajax web app from scratch,"Learn Rails fundamental and how to build ajax web based application from scratch with Rails 5, Boostrap, jQuery",Eding Muhamad Saprudin,5.0,55,6.5 total hours,68,All Levels,149000,Highest rated
Two-layered online form validation with jQuery and PHP,Learn how to apply two layers of validation to your online forms with this jQuery form validation tutorial,Sebastian Sulinski,5.0,6,1 total hour,18,All Levels,279000,-
Zend Framework Certification Practice Exam,Test your knowledge and prepare to take the official exam,Exware ID,5.0,1,-,-,Beginner,149000,-
Angular with PHP - build a SPA application,Apply modern programming techniques in practice by creating Single Page Application using Angular and PHP,Nevyan Neykov,5.0,1,1.5 total hours,17,All Levels,149000,-
Ruby On Rails series - MVP - Case study - Warehouse,A MVP on hotel’s warehouse management to validate the project’s feasibility and guarantee its success.,"Alessandra Santos Dias, Jorge Luiz Ferreira Dias",5.0,1,40 total mins,14,Intermediate,149000,-
jQuery - from zero to hero,For all who always wanted to learn jQuery,Tim Forest,5.0,1,12.5 total hours,158,All Levels,149000,-
Bootstrap 4 from Scratch,Learn the Bootstrap 4 framework and build amazing websites with top quality,Victor Bastos,5.0,2,3 total hours,21,Beginner,149000,-
HTML & CSS for Normal People,Project-based learning for fron-end web development,Leo Urushibata,5.0,1,2.5 total hours,42,Beginner,149000,-
WordPress Security: Protect your website from being hacked,"More than 30,000 sites are hacked everyday - don't be in one of them! Just not protect WordPress, in-fact hide WordPress",Saujan Man Pradhan,5.0,1,1.5 total hours,20,All Levels,149000,-
Learn PHP and MYSQL- Build a Customer Loyalty Reward System.,"Lets learn how to build a customer loyalty reward system in HTML5, CSS3, JavaScript, jQuery, PHP and MYSQL.",Alex Mureithi Njagi,5.0,7,13.5 total hours,77,Beginner,149000,-
Learn Alpine.js: Up & Running with Alpine.js v3,"Learn all about version 3 of the new, lightweight, JavaScript framework.",Koen Woortman,5.0,1,39 total mins,14,Beginner,149000,New
Learn CodeIgniter 4 API Development Tutorial Step by Step,"Complete API Development Guide Using Basic, JWT Authentication",Online Web Tutor,5.0,1,7.5 total hours,50,All Levels,149000,-
Learn TypeORM for NestJS Fast,Learn the basics of TypeORM development for NestJS,CodeBrains.IO Tech Training,5.0,2,1 total hour,19,Beginner,149000,New
The Ultimate YAML Course - Learn YAML from Scratch,"YAML tutorial for working with OpenAPI Specification, Swagger Tools, Azure DevOps, Kubernetes - the list goes on!",Praveenkumar Bouna,5.0,1,2.5 total hours,42,Beginner,149000,New
Mastering Spring Boot: A to Z,Leverage the rich Spring ecosystem to create complex and secure applications with Spring Boot,Charles Malott,5.0,4,6.5 total hours,91,All Levels,149000,New
PHP for Beginners 2021: Part 4 - Build a Game,"Use HTML, CSS, PHP and the HTML5 canvas to create a simple Hangman game",Patrick Morrow,5.0,2,4.5 total hours,47,Beginner,149000,Hot & new
Building and Managing Web Applications in AWS,Accelerate your Web Application deployment and migration using AWS cloud tools,Khalil Security,5.0,2,2.5 total hours,10,All Levels,149000,-
Fundamentals Of HTML 2021,Learn Basics of HTML Programming from Scratch,Siddhant Bedmutha,5.0,1,2.5 total hours,10,Beginner,149000,-
Laravel From A to Z,Laravel | Create a Complete Website,Mustafa Alawi,5.0,3,7 total hours,84,Beginner,699000,-
The Bootstrap 4 From Scratch With Real Projects,"Learn Flexbox, HTML5, CSS3 & Bootstrap build responsive websites and master Bootstrap 4 with my Bootstrap course",Oak Academy,5.0,23,7.5 total hours,65,All Levels,149000,Highest rated
Build Task Management Web App using Laravel,Create Your Own Task Management System,Mustafa Alawi,5.0,4,3 total hours,33,Intermediate,1099000,-
Complete ASP.NET MVC Course with Real World Practices,"Learn MVC with hands-on examples, build secure web applications with ASP.NET MVC and C#, become web developer with MVC",Oak Academy,5.0,30,19 total hours,127,All Levels,149000,Highest rated
Let’s Build Doctors - Patient Management Web App Together,Uncovering how to create an actively in-use web application.,Gorjan Mishevski,5.0,1,2.5 total hours,39,All Levels,149000,-
Host websites for (Dev/Test/Prod) at home or small office,Host/Build/Test any website or business application from home or small office and save time and finance!,David Soden,5.0,4,5 total hours,41,All Levels,149000,-
JavaScript Regular Expressions (regex) with Projects [New],"Hands-on Input Validation, Data Parsing, Transformation, Cleanup - Use in Angular, React, Vue and Node.js apps",Chandra Lingam,5.0,7,3.5 total hours,64,All Levels,149000,-
Node.JS Express Security: Authentication and Authorization,Mastering authentication and authorization with Node.JS Express,Agus Kurniawan,5.0,1,2 total hours,21,All Levels,149000,-
"Create easy leadin pages, surveys & scarcity to your WP","Skyrocket Your Clicks, Sales, survey your audience and collect new leads by keeping distractions low and engagement high","Fadwa Soliman, Kenz Soliman",5.0,7,34 total mins,8,Beginner,149000,-
Vue JS 2 - Beginners Guide To Fundamentals March 2019,Learn Vue JS the practical way with examples.,Vamshi Krishna,5.0,2,2.5 total hours,24,Beginner,149000,-
"Build Self Order Kiosk Like Mcdonalds (React Context, MUI)",Be master in react context and hooks step by step in a real world project,Bassir Jafarzadeh,5.0,2,3 total hours,14,All Levels,149000,-
Laravel From The Basics to Build Large Apps and Rest APIs,"learn the php framework laravel,the tutorial starts from the very basics to build complex applications",Mohamed Jolti,5.0,1,6.5 total hours,40,All Levels,149000,-
Vue 3 Essentials,Build The Solid Foundation of Vue Skills to Take Your Web Development to a Next Level,Mayank Chaudhari,5.0,6,5 total hours,48,All Levels,149000,-
How to Create a WordPress Blog from Scratch with Divi,Learn how to build your very own WordPress blog with the powerful & easy-to-use Divi theme and get started blogging!,Benny Kick,5.0,4,5.5 total hours,44,All Levels,149000,-
React for the Absolute Beginner - ReactJS App Fundamentals,"Components, Virtual DOM, State, Controls, APIs, JSON, Developer Tools, Bootstrap Design and Django Framework Integration","Nick Walter, Mohammad Azam",5.0,3,5 total hours,51,Beginner,149000,New
Salesforce Javascript Certification-Lightning Web Components,Learn the LWC framework and prepare to complete your JavaScript specialist super-badge ASAP.,Matthew Semroska,5.0,2,3.5 total hours,29,Intermediate,149000,New
Java Programming 2021: 10 Powerful Web Development Projects,"Java Web Application Development Course, Learn To Build Java Projects Using JSP, JDBC, Servlets,Swing,Maven, Spring Boot",Engineering .Org.In,5.0,9,18 total hours,82,Beginner,149000,New
Database performance for Hibernate developers,"DB performance tuning in applications that use Spring Data JPA. Learn SQL tuning, indexes, Hibernate best practices.",Arkadiusz Fronc,5.0,1,4.5 total hours,35,All Levels,149000,New
WooCommerce WordPress Ecommerce Course. Master it in 2 hrs!,Make a great Ecommerce Website using WordPress WooCommerce Plugin. Super course with step by step process explaination.,Academy365 .NET,5.0,9,2.5 total hours,16,Beginner,149000,-
Complete Spring Batch Masterclass: A to Z,"Learn how to implement a robust, scalable, distributed batch processing system using open-source frameworks",Carlo Dinkel,5.0,8,5 total hours,54,All Levels,149000,New
Fullstack Laravel API development with Nuxt and Linux - 2020,"Become a Fullstack Laravel Engineer by developing a Dribbble Clone, Provisioning a server and Deploying with SSL",Neba Funwi-gabga,5.0,168,19 total hours,145,All Levels,149000,Highest rated
Wordpress Plugin Development with Angular.js (2021),How to develop a plugin for Wordpress with AngularJS 1.8,Guillaume Duhan,5.0,14,1 total hour,9,Beginner,149000,Highest rated
Bootstrap Practice Exams for Certification and Interviews,Take Bootstrap Practice Exams,Ahmed Magdy,5.0,6,-,-,Intermediate,149000,-
PHP Essentials and MySQL basics,Course for developers who want to get necessary knowledge in PHP and MySQL,Coders GUID,5.0,8,8 total hours,46,Intermediate,149000,-
JavaScript in Action create 3 fun JavaScript coding projects,Explore how you can build interactive and dynamic web content using JavaScript to create fun mini projects,Laurence Svekis,5.0,9,1.5 total hours,34,All Levels,149000,-
CSS Friday: Learn Up-to-Date CSS Styling Techniques (2021),Learn the most up-to-date real-world solutions for a wide range of old web design problems!,Rahul Giri,5.0,13,14.5 total hours,57,All Levels,149000,-
PHP Hospital System Using CodeIgniter Framework(2020) Part 2,This is the only course where complete erp software is fully developed using the most simpliest approach for very secure,Olawuyi Segun Orisunola,5.0,20,19 total hours,185,All Levels,149000,Highest rated
Learn Flask by Creating Movie Search Engine,Create a complete web app using Flask Framework (Python),Mustafa Alawi,4.9,3,2.5 total hours,33,Beginner,1099000,-
"PHP for Beginners 2021 Part 5: PHP, PDO, MySQL, jQuery AJAX",This is a short course designed to introduce you to how to use the jQuery AJAX method to populate a dropdown list.,Patrick Morrow,4.9,27,1 total hour,15,Intermediate,149000,Highest rated
"Build Modern Responsive Website With HTML5, CSS3 & Bootstrap","Learn HTML5, CSS3, jQuery, Bootstrap And Build Modern Responsive Website With Modern Trends From Scratch.",Irfan Dayan,4.9,1115,14 total hours,114,All Levels,149000,Highest rated
Fundamentals of CSS,Build a Foundation with CSS You Can Use For Life!,Daniel Stern,4.9,14,2 total hours,29,Beginner,149000,-
