name,description,instructor,rating,reviews,total_hours,num_of_lectures,difficulty,price,badge
Professional Web Scraping with Java,Learn how to scrape data from any static or dynamic / AJAX web page using Java in a short and concise way.,Patrick Meier,4.6,173,1.5 total hours,18,Intermediate,149000,-
Build your own Load Balancer on AWS,Create and test your own cloud load balancer,Vishu Kamble,4.6,188,2.5 total hours,21,Beginner,149000,-
Core HTML How to get online quickly HTML to HTML5,Learn HTML all the basic fundamental building blocks to create websites. Learn HTML from scratch. HTML5 CSS explained,Laurence Svekis,4.6,49,3.5 total hours,35,Beginner,149000,-
"Vue 3, Nuxt.js and NestJS: A Rapid Guide - Advanced","VueJS with Typescript, Nuxt.js, Vuetify, Composition API, NestJS, Docker, Redis, Stripe, Frontend & Backend Filtering",Antonio Papa,4.6,11,8.5 total hours,87,Intermediate,149000,-
Angular 7 with Angular Material and Firebase Cloud Firestore,"Learn Angular 7+ by example with Cloud Firestore and Angular Material. Includes CRUD, Authentication, Routing, HTTP.",Patrick Schroeder,4.6,176,3 total hours,49,All Levels,149000,-
MS SQL with C#,"Learn C#, MS SQL Server, Ms SQL Backup & Recovery, how to connect C# to SQL and more with this comprehensive SQL course",Oak Academy,4.6,34,24.5 total hours,206,All Levels,149000,-
Python and Django Full Stack Web Developer Bootcamp,"Learn to build websites with HTML , CSS , Bootstrap , Javascript , jQuery , Python 3 , and Django!",Jose Portilla,4.6,39792,32 total hours,198,All Levels,149000,Bestseller
Wordpress for Beginners: Build your Brand with Wordpress,"Learn Wordpress, Build a Professional Website, Launch your Business and Sell your Products and Services Quickly",Fran Solo,4.6,38,8.5 total hours,121,Beginner,149000,-
Vue JS 3: The Composition API,"Learn Vue.js 3 with TypeScript, the Composition API and Vue Test Utils.",Lachlan Miller,4.6,77,5.5 total hours,57,Intermediate,569000,-
Implement High Fidelity Designs with Material-UI and ReactJS,Bridge the gap between Design & Development! Break down detailed designs and bring them to life with Material-UI/React.,Zachary Reece,4.6,1607,40.5 total hours,244,Intermediate,149000,Bestseller
Salesforce Development Training for Beginners,Salesforce Development :Learn about Apex programming and Salesforce development. Become a Salesforce Developer.,Deepika Khanna,4.6,4765,14 total hours,110,All Levels,149000,Bestseller
React Native - The Complete 2021 Guide with NodeJS & MongoDB,"All React Native concepts ( Redux, Hooks, Context ) are in this course. Learn React from scratch with NodeJS and MongoDB","Oak Academy, Muhammet Gokturk",4.6,12,17.5 total hours,151,All Levels,149000,-
Angular 2+ with Typescript - Essential Training,"Learn Angular 2 (or 4) from the ground up | This course combines a Project, Slides and Quizzes | Perfect for beginners",Patrick Schroeder,4.6,1764,3 total hours,66,Beginner,149000,-
Professional RESTful API Design using Python Flask,Learn the fundamental concepts and build a RESTful API application from scratch,Jorge Escobar,4.6,157,4.5 total hours,37,Intermediate,149000,-
Accelerated JavaScript Training,"Take a deep dive into JavaScript, a Must-Know Language in Web Development, with a Hands-on, Example-driven Approach",Maximilian Schwarzmüller,4.6,4842,7.5 total hours,128,All Levels,149000,-
"Medical WordPress Website for Hospitals, Clinics & Doctors","Create website for Dentist, Clinic, Pediatrician, Medical Laboratory, Ophthalmologist, Pharmacy, Medicine, Geriatrician,",Shashank WordPress Dev,4.6,27,3.5 total hours,37,All Levels,159000,-
Build a Blockchain & Cryptocurrency | Full-Stack Edition,"Full-stack blockchain programming course! A backend + frontend with Node.js, Jest, Express, React, Heroku, & more!",David Joseph Katz,4.6,1716,15 total hours,125,Intermediate,299000,-
Testing REST APIs using Postman,"Manual and Automated Testing, Collections, Environment Variables, Mock Servers, Monitors",Learning District,4.6,96,3 total hours,24,All Levels,149000,-
How to make an eCommerce Website | eCommerce Website,eCommerce website in WordPress | How to create an eCommerce Website | How to make eCommerce Website for business,Saif Ali KHAN,4.6,5,37 total mins,6,All Levels,149000,-
Bootstrap 4 for Beginners Build a modern Responsive website,Bootstrap 4 for Beginners Build a modern Responsive website with bootstrap The Complete Course of Bootstrap websites,Muhammad Ismail,4.6,33,1.5 total hours,15,All Levels,149000,-
Learning JavaScript Programming Tutorial. A Definitive Guide,Master the art of JavaScript Programming. A practical hands on tutorial that builds real JavaScript programming skills,Infinite Skills,4.6,503,9.5 total hours,93,All Levels,149000,-
Complete Angular 11 - Ultimate Guide - with Real World App,"Angular 11, Angular 12 Material, REST API, JWT Authentication, Angular Project, Asp.Net Core, Dashboard, Durgasoft",Web University by Harsha Vardhan,4.6,2322,38.5 total hours,247,All Levels,149000,-
Effective ways to program in C: Mastering C the easy way,This course on C language covers all the essential concepts in detail with hands-on example.,Shailesh Srivastava,4.6,14,7.5 total hours,52,All Levels,149000,-
The Complete Guide to Building Premium WordPress Themes,Create a Premium Wordpress Theme From Scratch. Learn All About WordPress Theme Development. Get Approved On Themeforest.,Ali Alaa,4.6,571,18 total hours,126,Intermediate,149000,-
Build a Crypto Currency Portfolio App With Ruby on Rails,How To Use An API To Get Crypto Currency Data With Ruby On Rails,John Elder,4.6,134,4 total hours,57,Beginner,149000,-
The Complete Web Development Tutorial Using React and Redux,Master the professional web development techniques using React and Redux,Eduonix Learning Solutions,4.6,67,4 total hours,30,Intermediate,149000,-
Angular 5 - A 3-Step Process to Master Angular for Beginners,Learn Angular like a Professional! Start from the basics and go all the way to creating your own Angular apps and games!,"Dr. Chris Mall • 25,000+ Students Worldwide",4.6,18,5 total hours,46,All Levels,149000,-
Zoom API For Website -Integrate with PHP CodeIgniter Quickly,This is the only course on this platform where zoom live streaming API is fully integrated to the school management,Olawuyi Segun Orisunola,4.6,36,4 total hours,40,All Levels,149000,Highest rated
WordPress Complete Course 2021 -Master WordPress Easily[New],Learn WordPress + Elementor + WooCommerce All In one guide |Complete WordPress Course Beginner To Pro,Vikash Mishra,4.6,38,3 total hours,36,All Levels,149000,Hot & new
Tailwind CSS - A new way to > THINK < CSS,Create Web Pages fast with this amazing CSS framework: Configure and implement!,Martin Eberth,4.6,161,7.5 total hours,55,All Levels,149000,Bestseller
Practical Full Stack Web Development Course (100+Challenges),After this action-packed course you will be able to build any website that you can imagine!,Gancho Radkov,4.6,21,15.5 total hours,120,All Levels,149000,-
How To Make A Membership Website With WordPress,Do You want to create your own membership website with WordPress? I will show you how with NO EXPERIENCE!,Darrel Wilson,4.6,41,1 total hour,11,Beginner,149000,-
Introduction to Website Development,"Learn HTML, CSS and Javascript",Yonis Mohamoud,4.6,200,4 total hours,72,Beginner,149000,-
Building Professional Websites Locally Without Web Hosting,"One-click WordPress installation, Hot swap environments, Advanced development features",Muhammad Usman,4.6,144,44 total mins,18,All Levels,149000,-
WordPress SEO 2021 - The Complete WordPress SEO Blueprint,"Learn about WordPress SEO, Keywords, Google Trends, Page Authority, Speed Optimization, Bounce Rates and so much more","Alexander Oni, Lab",4.6,71,5.5 total hours,66,All Levels,149000,Bestseller
Vue JS 3 Modern Web Development with Vuex & Vue Router,Learn Vue3 Web Development Quickly From the Absolute Beginning. Exercises and Challenges Included for fast learning.,Ivan Lourenço Gomes,4.6,69,7 total hours,47,All Levels,149000,-
Build a rental car website from scratch,Online Car Rental Service,Eldor Togaymurotov,4.6,26,14.5 total hours,124,Beginner,149000,-
Using gRPC in Microservices Communication with .Net 5,Building a high-performance gRPC Inter-service Communication between backend microservices with .Net 5 and AspNet 5,Mehmet Özkaya,4.6,94,7.5 total hours,93,Intermediate,149000,-
Advanced Laravel and Vuejs - Build a Youtube clone,"Learn the advanced concepts of the laravel and vuejs frameworks, and also build a complete real world project",Kati Frantz,4.6,180,6 total hours,42,Intermediate,149000,-
WordPress for Beginners (Step by Step Guide),Learn how to build your own website with WordPress for professional and personal use. Follow these step by step guide.,TC Academy,4.6,19,2 total hours,18,Beginner,159000,-
Complete Customizer Development For WordPress Themes/Plugins,Use best practices and coding standards with the Theme Customizer to create theme options for any WordPress theme/plugin,Bruce Chamoff,4.6,17,5.5 total hours,43,All Levels,149000,-
Modern Javascript for Beginners 2020 + Javascript Projects,The ultimate beginners course for Javascript - Learn Modern Javascript for 2020 with a plenty of examples and projects,DigiFisk (Programming is fun),4.6,586,15 total hours,113,Beginner,149000,-
Angular Crash Course for Busy Developers,Have limited time to learn Angular 4 (Angular 2+)? Take this course and learn Angular in 10 hours!,Mosh Hamedani,4.6,16853,10.5 total hours,137,All Levels,149000,-
Professional Blog+CMS Development With Laravel 5,Build Professional Blog+CMS with Laravel 5.x and take your Laravel skills to the next level,Eding Muhamad Saprudin,4.6,310,11.5 total hours,94,All Levels,149000,-
GoLang Websockets Node Rest MVC API DualBoot,Coding is life.,Zach LaCourse,4.6,3,16 total hours,144,All Levels,149000,-
"React Native: Tips, Tricks, and Techniques",Boost your React Native skills for quick solutions and results,Packt Publishing,4.6,11,3.5 total hours,23,Beginner,149000,-
JavaScript for complete beginners with practical exercises,Build the real world JavaScript projects from scratch.,Navjot Singh,4.6,129,2.5 total hours,44,Beginner,149000,-
Fullstack Go Golang Node.Js Python PHP Sci Fi Dev Framework,Unleash your creativity ( Websockets Enabled ),Zach LaCourse,4.6,12,9.5 total hours,57,All Levels,149000,Highest rated
Django 2 for Beginners (Part 1) - Learn by Building Web App,Learn Django 2 - Build Strong Django Foundation By Building Task Manager Web Application With Python & Django Framework!,Shubham Sarda,4.5,9,3.5 total hours,41,All Levels,149000,-
Build a Task Scheduler Admin Panel with Laravel,Learn how to create scheduled tasks using an Admin Panel UI built in Laravel 5.6,Arturo Rojas,4.5,25,2.5 total hours,11,Intermediate,149000,-
WordPress FREE Hosting on Google Cloud,"Free WordPress Hosting, Free Professional Email and more.",Hong Ly,4.5,2,1.5 total hours,25,All Levels,149000,-
AngularJS 1.0 Masterclass - Deep Dive & Understand AngularJS,"Understand Core Concepts, Create Custom Directives, Custom Services, Routing and Hands On Using Modularized Approach.",Sandip Gautam,4.6,1456,6 total hours,85,All Levels,149000,-
Understanding NPM - Node.js Package Manager,"Understand and practice NPM. Learn how to use NPM in Node.js, how to install NPM packages, how to configure NPM scripts.",Bogdan Stashchuk,4.5,558,2.5 total hours,41,All Levels,149000,-
Build Responsive Real World Websites with CSS3 v2.0,"Learn CSS3 Flexbox, CSS3 Animations, Transitions, Transformations and Responsive Web Design. Make beautiful websites!","Kalob Taulien, Kalob.io — Learn web development from scratch",4.5,1072,13 total hours,181,All Levels,149000,-
How to build a website using WordPress,Wordpress Tutorial : Wordpress Course - Website Installation & creation Step By Step : Create A Wordpress Website,"Rajiv Khattar, Swati Khattar",4.5,62,5.5 total hours,74,Beginner,149000,-
Angular JS with Sample Project (from Basic to Advanced),Learn Angular JS - Every module feature demonstrated with real-time examples,Sandeep Soni,4.5,57,8.5 total hours,29,Beginner,159000,-
Web Security: Common Vulnerabilities And Their Mitigation,"A guide to dealing with XSS, session hijacking, XSRF, credential management, SQLi and a whole lot more",Loony Corn,4.5,167,8 total hours,56,All Levels,149000,Bestseller
AWS Cloud Management Tools and Services,Organising and Controlling Cloud Applications on Amazon web services,Harshit Srivastava,4.5,14,1.5 total hours,21,All Levels,149000,Highest rated
Advanced Drag and Drop uploader and Cropping System,Learn how to create drag & drop uploading and cropping system from scratch to advance,Faraz Abbas,4.5,15,2.5 total hours,11,All Levels,149000,-
Build Responsive Real World Websites with HTML5 and CSS3,"Convert 3 Modern Photoshop Designs into 3 Stunning responsive websites using HTML5 CSS3, jQuery and Bootstrap 4",Omar Hegazi,4.5,79,10 total hours,59,All Levels,149000,-
Jumpstart Your Software Development Career,"Increase your confidence, gain a competitive edge, and increase your value to the organizations you work for",Kirt Henrie,4.5,8,3.5 total hours,41,Intermediate,149000,-
Amazon s3 Mastery - THE How-To' Guides For Amazon S3,*UPDATED 2020* Amazon S3 & AWS are Easy Once You Know How. Follow My Step-By-Step Guides & Master Amazon S3 Quickly.,Steve Dougherty,4.5,692,3.5 total hours,42,All Levels,149000,Bestseller
PHPUnit - Unit & Selenium Testing For PHP Developers,Includes Test-Driven Development (TDD) by creating real life app with PHP & PHPUnit and Selenium acceptance testing,"Symfony, Laravel & PHPUnit Stuff",4.5,73,10.5 total hours,78,All Levels,149000,-
Vue 3 and Golang: A Practical Guide,"Go APIs, Vue 3 Composition API, Typescript, Vuex, MySQL, Upload Images, Export CSV",Antonio Papa,4.5,26,6.5 total hours,69,All Levels,149000,-
Animating with the JavaScript Web Animations API,Give your web animations super-powers by with the JavaScript Web Animations API,Ben Frain,4.5,5,2 total hours,23,Intermediate,149000,-
Landbot: User Experience Design (UX) to Functioning Chatbot,"Chatting with Humans: Design, Build, Publish and Monitor Engaging Chatbots for Websites, WhatsApp, or Facebook",Tom and Angela Hathaway,4.5,13,3.5 total hours,71,All Levels,149000,-
Uploading images to PHP Server via AJAX,Explore how you can use AJAX and HTML forms to upload images to PHP servers,Laurence Svekis,4.5,54,1.5 total hours,21,Beginner,149000,-
The Complete 2020 Web Developer Master Course,Everything you need to know to become a Web Developer in 2020!,Jesse Caine,4.5,917,66 total hours,360,All Levels,149000,-
The Complete React Js & Redux Course - Build Modern Web Apps,"Go from Beginner to React Js Expert by building an Instagram Like Web App with React 16, React Router, Redux & Firebase!","Codestars by Rob Percival, Rayan Slim, Rob Percival, Jad Slim",4.5,2491,8.5 total hours,71,All Levels,149000,-
Php mysql Development with Ajax & Modern JavaScript ES6,Learn php mysql development with Ajax and Modern JavaScript ES6,Franckk John,4.5,9,8 total hours,57,All Levels,149000,-
Web Developer Bootcamp with Flask and Python,"Become a Full Stack Web Developer using Flask, Python, HTML, CSS, and MongoDB!","Jose Salvatierra, Teclado by Jose Salvatierra",4.5,5096,27.5 total hours,282,Intermediate,149000,-
"Learn Basic HTML, CSS & Javascript (Typescript) with Angular","Learn the basics of Web Development Fast and save time with HTML, CSS, Typescript and Angular.",CodeBrains.IO Tech Training,4.5,17,1 total hour,30,Beginner,149000,New
Website Secrets: Get a Gorgeous Website on the Cheap,"Website : Work smarter on your website development, design and implementation through intelligent subcontracting",Christos Pittis,4.5,19,2 total hours,32,All Levels,149000,-
WordPress REST API and AJAX pages and forms - FAST TRACK.,Learn how to create refreshless pages and to develop AJAX forms and pages.,Craig West,4.5,14,3 total hours,43,Intermediate,149000,-
Build WordPress Plugin to extend Beaver Builder,Learn how to build your own WordPress plugins that allow you to extend Beaver Builder with your own custom modules,Jon Mather,4.5,37,2 total hours,17,Intermediate,149000,-
Build ECommerce Shopping Cart By React & Redux 2020 Edition,"Become a Senior React Developer! Build a massive E-commerce app with Redux, React Router, React Reveal and more",Bassir Jafarzadeh,4.5,424,5.5 total hours,16,All Levels,149000,-
Introduction to jQuery,"We cover the basics of jQuery including effects, manipulation, dynamic creation of elements, and interaction events.",RefactorU LLC,4.5,20,1.5 total hours,28,Intermediate,149000,-
Mapping in Leaflet JS,Data | Plugins | Layouts | Interactivity,Victor Temprano,4.5,146,5.5 total hours,31,Beginner,149000,-
The essential guide to Firebase with React.,Create modern app using modern technologies,Coding Revolution,4.5,100,31.5 total hours,175,Beginner,149000,-
JSON in Action: Build JSON-Based Applications,Learn JSON from Scratch! Learn JavaScript Object Notation (JSON) to Build API-Based Apps! Develop 2 JSON-Based Projects,Crypters Infotech,4.5,658,4.5 total hours,40,All Levels,149000,-
Vue JS and .NET Core Web API Full Stack Master Course,learn to create a full stack web application from scratch using .NET Core Web API and Vue JS.,Vinay Kumar,4.5,5,4 total hours,76,Intermediate,149000,New
VanillaCartJS - ES6 JavaScript Shopping Cart,Create A Real World Shopping Cart Project And Learn JavaScript ES6 Along The Way,Adrian Bienias,4.5,211,2.5 total hours,10,All Levels,149000,-
"Angular Material, Universal & Laravel: A Rapid Guide","Angular Material, Angular Universal, Laravel 8, Laravel Sanctum, Docker, Redis, Stripe, Frontend & Backend Filtering",Antonio Papa,4.5,21,8.5 total hours,82,Intermediate,149000,-
WordPress Security Masterclass - Defeat Hackers & Malware,Learn basic to advanced techniques on how to properly secure and harden your WordPress website against hacks and malware,"Alexander Oni, Lab",4.5,188,3.5 total hours,46,All Levels,149000,Bestseller
Unix For Beginners - MAC OS - Linux - Ubuntu,Learn to use the command line in your MAC or Linux Computer,Edwin Diaz,4.5,53,2 total hours,23,All Levels,149000,-
jQuery for Beginners - Create Website Animations Easily,jQuery for Beginners : Learn this Javascript Framework to add animations easily and fast to any website.,"Edwin Diaz, Coding Faculty Solutions",4.5,781,3 total hours,28,All Levels,149000,-
Build a Shopify Theme From Scratch,Learn how to create themes in Shopify,Jay Lee,4.5,828,7.5 total hours,38,All Levels,149000,-
Practical Liquid Markup Examples for Adobe Business Catalyst,Learn how to solve real-world problems using Liquid Markup for Business Catalyst. Courses come with usable code.,"Scott Reynolds, Dave Haggblad",4.5,22,3 total hours,22,Intermediate,149000,Highest rated
Project with Laravel PHP:Make a doctor appointment system,"Make a doctor appointment web application with Laravel, PHP framework",Ranjeet Karki,4.5,82,12 total hours,86,Intermediate,149000,-
Angular & Laravel Authentication: Forgot and Reset Password,"Learn PHP 8, Laravel 8, Angular 10, Laravel Sanctum, Send Emails with Mailhog, Typescript",Antonio Papa,4.5,25,1.5 total hours,21,Beginner,149000,-
d3.js - Complete Developer Data Visualization Guide,"Bring Data to life with D3.Js Data Visualization Library. Master JavaScript, HTML, CSS and Build Stunning Data Visuals","Paulo Dichone | Android, Java, Flutter Developer and Teacher",4.5,248,17.5 total hours,157,All Levels,149000,-
Become A Full Stack Web Developer in 14 Days,"Learn all the skills that are needed by companies today, and land your next dream job.",EDUmobile Academy,4.5,105,13.5 total hours,126,All Levels,149000,-
React Hooks,Learn the future of creating React apps today!,Reed Barger,4.5,1634,3 total hours,39,All Levels,149000,-
Entrepreneurship For Engineers: Master Business & Marketing,"Techie, programmer, coder, IT or Computer Science major? Become an entrepreneur & learn business for non-business people",Alex Genadinik,4.5,37,8 total hours,67,Beginner,149000,-
Laravel Vuejs Private (one to one) Chat App,"An Advanced One to One Chat App with Laravel as backend, Vuejs as frontend & Pusher Channels for making things Real Time",Sarthak Shrivastava,4.5,122,6.5 total hours,86,Beginner,149000,-
"STARTUP APACHE, MYSQL, AND PHP","Learn how to startup APACHE, MYSQL, and PHP on a local PC, and use these technologies for building a dynamic website.",Mohamed Hosny,4.5,13,4 total hours,32,All Levels,149000,-
Use Vuejs 2 to Create a Beautiful SEO-Ready Website,Discover the power of using Vuejs to create modern websites that are SEO-Friendly.,Gary Simon,4.5,45,2 total hours,15,Beginner,149000,-
How to Create A Website: An HTML Tutorial and CSS Tutorial,Learn How To Make Websites from a University Professor in Computer Science with over 15 years of teaching experience.,Todd McLeod,4.5,1719,32.5 total hours,330,All Levels,149000,-
React.js - Let's build a Tic Tac Toe game.,Helping you build your React.js portfolio,Daryl Duckmanton,4.5,33,2 total hours,27,Intermediate,199000,-
"Angular, Ionic & Node: Build A Real Web & Mobile Chat App",Learn to connect your Angular and Ionic Frontend to a NodeJS & MongoDB backend by building a real web & mobile chat app,Uzochukwu Eddie Odozi,4.5,206,37 total hours,416,All Levels,149000,-
Laravel 6 Starter Course,Learn Laravel effectively by building real world projects with Laravel 6.x,Eding Muhamad Saprudin,4.5,610,12 total hours,101,Beginner,149000,-
E Commerce Website Development In PHP With PDO,A-Z Guidelines With Full Practical To Develop An E commerce Website In PHP With PayPal And Cash On Delivery Method,Mr. Azaz Aiyub Patel,4.5,29,34 total hours,100,All Levels,149000,-
WordPress Theme Development With Unyson & Bootstrap 4,"Create your own custom WordPress theme with Bootstrap 4, HTML, CSS, PHP, for yourself, your clients and for the world!",Usman Mughal,4.5,21,14.5 total hours,56,Beginner,149000,-
Complete React JS web developer with ES6 - Build 10 projects,"Master react JS, ES6, firebase, Auth0. Along with reactjs basics, create 10 projects",Igneus Technologies,4.5,1269,12.5 total hours,76,Beginner,149000,-
Build Professional Wordpress Websites as a Complete Beginner,"Why pay top dollar for Wordpress websites, when you can charge top dollar?",Thas R. Eagans,4.5,7,4.5 total hours,47,Beginner,149000,-
Create Chatbot for Website with React and Node.js,"Create a chatbot for webpage with React and Node.js. Teach chatbot to sell products, give recommendation, measure demand",Jana Bergant,4.5,523,10 total hours,109,Intermediate,149000,-
Become a Professional Web Developer | Version 3.0,"Everything you need to know to become a professional web developer from scratch, updated for modern development.",Stone River eLearning,4.5,426,60 total hours,453,All Levels,149000,-
Learn Nodejs by building 12 projects,Become an Expert Nodejs Developer While Building Real World Applications,"Eduonix Learning Solutions, Eduonix-Tech .",4.5,1929,12.5 total hours,72,All Levels,149000,-
HTML & HTML5 Crash Course for Entrepreneurs,Start Your Web Development Career by Learning HTML and HTML5.,Devwebtuts 24/7,4.5,15,3.5 total hours,51,All Levels,149000,-
Web Developer Toolbox- Essentials for Modern Web Development,"Simplify application development and deployment, by focusing on creating apps with improved capabilities",Packt Publishing,4.5,6,2.5 total hours,22,Expert,149000,-
Learn HTML5 Programming From Scratch,A Complete HTML5 Programming Course for Beginners,Eduonix Learning Solutions,4.5,14444,17 total hours,72,All Levels,159000,-
Angular Architecture. How to Build Scalable Web Applications,"Build a scalable and maintainable applications with Angular 9 (NgRx, Firebase, SCSS, Angular Material)",Danil Chigirev,4.5,129,7.5 total hours,200,Intermediate,149000,-
"Richard Stibbard's ""Ultimate Web Development Course""","Learn all the major web technologies in one full stack development project: HTML, CSS, MySQL, PHP, jQuery and AJAX",Richard Stibbard,4.5,635,12 total hours,136,All Levels,149000,-
Python for beginners,Master the fundamentals of Python while working on various usecases in easy steps,Bharath Thippireddy,4.5,18525,13 total hours,275,All Levels,149000,-
Front-End Developer 2019 Career Course,Become a professional front-end developer the right way and learn how to monetize your new acquired skills in 2019,Victor Bastos,4.5,35,13 total hours,110,Beginner,149000,-
Become a Web Developer (HTML5;CSS;JavaScript;Ruby;Ajax; SQL),Learn Practical Hands-on Web Development From Scratch,Bluelime Learning Solutions,4.5,175,20.5 total hours,207,Beginner,149000,-
Creative SVG Animation From Scratch [2021],Learn SVG by Using Advanced CSS Animations. Draw Vectors and Create SVG Web Animations.,Safak Kocaoglu,4.5,30,4 total hours,33,All Levels,149000,Bestseller
"HTML/CSS Bootcamp - Learn HTML, CSS, Flexbox, and CSS Grid","Learn HTML, CSS, Flexbox, and CSS Grid by building a professional website with modern front end development techniques.",Jordan Hudgens,4.5,633,21 total hours,150,Beginner,149000,-
AWS CloudFormation Master Class With YAML and JSON Templates,This is a master class in AWS CloudFormation with YAML and JSON templates,Cakewalk Services,4.5,17,5.5 total hours,37,All Levels,149000,-
Bootstrap 4 Crash Course: Introduction to Building Websites,Discover the possibilities of the new Bootstrap 4 Beta release - create and develop a responsive website from scratch!,Filip Kordanovski,4.5,33,3 total hours,33,All Levels,149000,-
The complete Vue JS course,Learn to build beautiful web apps using VUE js.Includes three practice projects.,Coding Revolution,4.5,367,25.5 total hours,204,Beginner,149000,-
Build a new and modern looking Responsive websites,Build a fully responsive website with Html 5 Css 3 Bootstrap and JavaScript,Adil Ahmed,4.5,203,9.5 total hours,47,All Levels,149000,-
