name,description,instructor,rating,reviews,total_hours,num_of_lectures,difficulty,price,badge
"MERN Stack Front To Back: Full Stack React, Redux & Node.js","Build and deploy a social network with Node.js, Express, React, Redux & MongoDB. Fully updated April 2019",Brad Traversy,4.6,13586,12 total hours,73,Intermediate,149000,Bestseller
Headless WordPress REST API Authentication,Learn how to connect decoupled websites and applications with WordPress using JWT Auth and JavaScript,Zac Gordon,4.6,41,3 total hours,16,Intermediate,149000,-
MEAN project with Angular 4 (and 5) - Creating a CMS,"Learn how to build a MEAN app with Angular 4 (and 5), Node/Express, MongoDB and Bootstrap",Fast & Easy Programming,4.6,113,3 total hours,44,All Levels,149000,Highest rated
Build Modern MEAN Stack Web App,"Modern MEAN Stack web Application development with Node.js, Angular, Nestjs, MongoDB",Haider Malik,4.6,6,11.5 total hours,94,Beginner,149000,-
Learn USSD application development in PHP and MySQL(2021),Gain more knowledge in USSD application development from scratch in PHP and MySQL! The complete guide!,Alex Mureithi Njagi,4.6,30,4.5 total hours,18,Beginner,149000,-
Learn XML Crash Course: Discover Essential XML Fundamentals,Jump into the world of XML with this fast and immersive course.,Simon Sez IT,4.6,405,2 total hours,17,Intermediate,149000,Bestseller
Ethereum and Solidity: The Complete Developer's Guide,"Use Ethereum, Solidity, and Smart Contracts to build production-ready apps based on the blockchain",Stephen Grider,4.6,14862,24 total hours,269,All Levels,149000,Bestseller
HTML & CSS - Learn to build sleek websites,"Level up your coding skills and create beautiful, responsive and accessible websites. Easy, fun and effective",Sandra L,4.6,21,3.5 total hours,44,All Levels,149000,-
ASP.NET Core MVC - Up and Running Part 1 (.NET 5),Learn ASP.NET Core 5 with MVC and Entity Framework Core as we build real world Paving Company project with .NET 5,"DotNet Mastery, Bhrugen Patel",4.6,476,7 total hours,100,Beginner,149000,-
Node.js: The Complete Guide to Build RESTful APIs (2018),"Learn to build fast, scalable and secure RESTful services with Node, Express and MongoDB, from setup to production",Mosh Hamedani,4.6,10087,15 total hours,224,Intermediate,229000,-
Node.js Absolute Beginners Guide - Learn Node From Scratch,Learn Node.js To Build Web Sites and Host Them Live On Heroku Webhosting,John Elder,4.6,110,2 total hours,22,Beginner,149000,-
Complete guide to building an app with .Net Core and React,"The complete guide to building an app from start to finish using ASP.NET Core, React (with Typescript) and Mobx",Neil Cummings,4.6,4000,68.5 total hours,625,All Levels,149000,Bestseller
Python Django Dev To Deployment,Learn Python and build & deploy a real estate application using the Django framework & PostgreSQL,Brad Traversy,4.6,4775,11 total hours,70,Intermediate,149000,-
Dissecting Ruby on Rails 5 - Become a Professional Developer,"Don't simply follow a tutorial, learn what it really takes to become a pro Rails developer with this immersive course.",Jordan Hudgens,4.6,2906,43.5 total hours,247,All Levels,149000,-
Learn React and Redux by examples (Updated to React 16.12.0),"Your practical guide to build a mobile-ready web applications using React, Redux and React Router",Vinod Kumar Kayartaya,4.6,121,5.5 total hours,31,All Levels,149000,Highest rated
CSS - MASTERING ANIMATIONS,Make your web page alive with css animations & transitions and take your web design skills to the next level,Driss Boumlik,4.6,377,2 total hours,28,Beginner,149000,-
Django Masterclass : Build Web Apps With Python & Django,"Learn Django from scratch, build an E-commerce store, web based PDF generators, web crawlers, APIs using Python & Django",Ashutosh Pawar,4.6,752,18 total hours,153,All Levels,149000,-
*NEW* Advanced Forms - 2021 Build & Master Web forms,Master web forms. Complete. From HTML design to sending to servers. Crucial for all front end development. Novice to Pro,Clyde Matthew,4.6,33,21.5 total hours,245,All Levels,149000,Bestseller
Bootstrap - Create 4 Real World Projects,Bootstrap - Bootstrap with lots of CSS and JavaScript. CSS Flexbox included.,"Code And Create, George Lomidze, Lasha Nozadze",4.6,750,10 total hours,64,All Levels,149000,-
Laravel 8 - Advance Course Build School Management System,"In This Course, You Will Learn Laravel 8 Fundamentals With Project and Complete Advance School Management System Project","easy Learning, Kazi Ariyan",4.6,271,60 total hours,268,All Levels,149000,-
Chrome Extensions: Beginners Guide to Building & Publishing,Step-by-step guide for web developers of any skill level who want to build & publish their first Google Chrome Extension,David Sealey,4.6,74,1.5 total hours,22,Beginner,149000,-
"MEAN Stack E-Commerce App: Angular 12, NX, PrimeNg [2021]","Build Great E-Shop with Admin Panel using the latest technologies: Nodejs , Mongo, Angular 12, Nrwl NX Monorepo, PrimeNG","Fadi Nouh, Tiago Pereira",4.6,244,27 total hours,224,All Levels,149000,-
JavaScript Projects for JavaScript Beginners,Interactive Front-End Development for Beginners,Rob Merrill,4.6,336,7.5 total hours,76,Beginner,149000,-
Getting Started with Deno,Learn Deno pros and cons with this series while solving typical problems,Oleksandr Kocherhin,4.6,4,2 total hours,16,All Levels,149000,-
How to Use Custom Fields in Wordpress Theme Development,Learn how to utilize over 20 powerful custom field types in our comprehensive guide to the Advanced Custom Fields plugin,Balboa & Bedford,4.6,152,3.5 total hours,33,All Levels,149000,-
The Complete HTML & CSS Course - From Novice To Professional,In this Course Students will be able to learn a Complete HTML & CSS Course taking them From Novice To Professional,"Joe Parys, Shahzaib Kamal, Joe Parys Support",4.6,1510,7.5 total hours,84,All Levels,159000,-
Learn and Understand D3.js for Data Visualization,Dive deep under the hood of D3.js. Learn core concepts and build stunning data visualizations using D3 version 7,Luis Ramirez Jr,4.6,967,9 total hours,92,All Levels,149000,-
The Ultimate Hands-On Lightning Web Component,The most complete Salesforce LWC Development course brought to you by a Google Software Engineer.,Manish Choudhari,4.6,2510,17 total hours,113,All Levels,149000,Bestseller
Introduction to web programming for GIS applications,"Understanding web programming fundamentals focused on geospatial applications using Leaflet, Turf.js, and PostGIS",Michael Miller,4.6,1091,14.5 total hours,103,Beginner,149000,Bestseller
Angular - The Complete Guide (2021 Edition),"Master Angular 12 (formerly ""Angular 2"") and build awesome, reactive web apps with the successor of Angular.js",Maximilian Schwarzmüller,4.6,150920,34 total hours,461,All Levels,149000,Bestseller
Angular Universal In Depth,"Learn Angular Universal (Angular 12), optimize your application performance, optimize it for SEO and Social Media",Angular University,4.6,313,4.5 total hours,32,All Levels,149000,-
The Complete 2020 Fullstack Web Developer Course,"Learn HTML5, CSS3, JavaScript, Python, Wagtail CMS, PHP & MySQL from scratch!",Kalob Taulien,4.6,5305,67 total hours,695,All Levels,149000,-
Vue 3 and Django: A Practical Guide with Docker,"Django 3.1, Vue 3, Docker, Typescript, Vuex, Authentication and Authorisation, Upload Images, Export CSV, c3.js",Antonio Papa,4.6,28,6 total hours,69,All Levels,149000,-
Learn JavaScript from Scratch: The Ultimate Beginners Course,Learn modern JavaScript programming fundamentals with practical hands training.,"Juan E. Galvan, Pace Ellsworth",4.6,34,6.5 total hours,61,All Levels,149000,New
Sharepoint 2013 Development,Sharepoint 2013 Development - complete guide,Sandeep Soni,4.6,49,26.5 total hours,63,Beginner,159000,Highest rated
"Build Realtime Apps | React Js, Golang & RethinkDB","A practical guide that teaches you ReactJs, Golang & RethinkDB. Optimally paced, no-nonsense. You'll learn quickly!",James Moore,4.6,1032,3 total hours,48,All Levels,149000,Bestseller
Flask Ultimate Course Build 4 Real World Projects,"Learn Flask and backend by creating : Url Shortener, image editing service , Limited Api, Bitcoin Wallet Service",Code Mode,4.6,2,7.5 total hours,56,Beginner,149000,-
Web Application with React JS and Redux,"Learn modern web application with ReactJS and Redux. Master React Router, React Portals, Redux and create React app!","Oak Academy, Uğur PEHLİVAN",4.6,5,9.5 total hours,83,All Levels,149000,-
Angular Security Masterclass (with FREE E-Book),Practical Guide to Angular Security - Add Authentication / Authorization (from scratch) to an Angular / Node App,Angular University,4.6,874,8 total hours,75,All Levels,149000,Bestseller
Responsive Web Development with HTML5 & CSS3 For Beginners,Build More Than Six(6) Real World Projects and Also Learn How To Host Your Website On Github!,Robert Nana Sarpong,4.6,59,7.5 total hours,38,All Levels,149000,-
Wordpress Plugin Development with JQuery (2021),How to code a plugin for Wordpress with jQuery,Guillaume Duhan,4.6,24,1 total hour,9,Beginner,149000,-
Build an app with ASPNET Core and Angular from scratch,A practical example of how to build an application with ASP.NET Core API (.Net 5.0) and Angular 10 from start to finish,Neil Cummings,4.6,16369,28.5 total hours,259,Beginner,149000,Bestseller
Build Ecommerce Website Like Amazon [React & Node & MongoDB],"Become a Senior Web Developer! Build a massive E-commerce app with React, Redux, Node, Express, MongoDB, Mongoose",Bassir Jafarzadeh,4.6,751,17.5 total hours,70,All Levels,149000,-
Angular interview questions with answers,Angular interview questions with answers,Shivprasad Koirala,4.6,505,2.5 total hours,8,Beginner,149000,-
So you think you know JavaScript?,What every intermediate and advanced developer needs to know!,"3D BUZZ Programming and Digital Art training, Nelson LaQuet",4.6,290,6 total hours,25,All Levels,149000,-
Django Crash Course,"Learn Django from scratch and get familiar with REST APIs, the Django Rest Framework, GraphQL APIs, Graphene & more!","Mihai Catalin Teodosiu, EpicPython Academy",4.6,34,7.5 total hours,72,Beginner,149000,-
Create a Business or Personal Website with Wordpress,Learn to Build a WordPress Website from Scratch on your Local computer or a Shared Hosting Sever without Code.,Bluelime Learning Solutions,4.6,101,3.5 total hours,33,Beginner,149000,-
Become a Front End Web Developer - JavaScript for Beginners,"Best JavaScript course for beginners with step by step instructions. Learn basics, ES6, DOM and AJAX with mini project.",Chandrasekaran Janardhanan,4.6,140,15.5 total hours,331,Beginner,149000,-
HTML5 and CSS3 - Essential Training,Learn HTML5 / CSS3 and how to incorporate markup to build standards-compliant and forward-thinking responsive web sites.,Zak Ruvalcaba,4.6,242,18.5 total hours,143,All Levels,149000,-
GraphQL by Example,"Learn GraphQL by writing full-stack JavaScript applications with Node.js, Express, Apollo Server, React, Apollo Client.",Mirko Nasato,4.6,1654,5.5 total hours,55,Intermediate,149000,-
"Make A Responsive Website Project #2: HTML, CSS & Javascript","Create A Responsive, Holiday Themed Website using HTML, CSS, Bootstrap, Animate.css, Javascript, JQuery and Snowstorm.js",Eric Tam,4.6,87,4.5 total hours,56,Intermediate,149000,-
Drupal For Absolute Beginners (2021),The Most Comprehensive Course To Start Learning Latest And Greatest Drupal From Scratch,Shubham Saurav,4.6,161,1.5 total hours,20,All Levels,199000,-
Bullet proof php for beginners - Code like a pro,Learn good programming practices and spend less time debugging,Julien Khong,4.6,9,8.5 total hours,74,Beginner,149000,-
WebRTC 2021 Practical Course. Create Video Chat Application,Learn WebRTC by creating Meet the Strangers app (Omegle clone with direct calls possibility) with vanilla JavaScript,Marek Gryszkiewicz,4.6,50,8.5 total hours,82,Beginner,149000,Bestseller
Next.JS with Sanity CMS - Serverless Blog App (w/ Vercel),"Build your own Blog App with the latest Next.JS & React(Next 9.4+, React hooks). Learn how to use headless Sanity CMS.","Eincode by Filip Jerga, Filip Jerga",4.6,153,13 total hours,82,All Levels,149000,-
Python Django Web Development of NLP App,Django Web Development with Python and Spacy,Zlatko Lazarevski,4.6,7,2 total hours,13,Beginner,149000,-
"Become a Certified HTML, CSS, JavaScript Web Developer","Complete coverage of HTML, CSS, Javascript while you Earn Four Respected Certifications","Framework Tech Media, Mark Lassoff",4.6,2287,46 total hours,523,All Levels,149000,-
Django Ecommerce | Build Advanced Django Web Application,"Build Django eCommerce website with a lot of advanced custom functionalities, RDS Postgres and deploy it on Amazon AWS",Rathan Kumar,4.6,337,20.5 total hours,129,All Levels,149000,-
Build a Google Meet Clone from Scratch: WebRTC & Socket io,"Learn webrtc and build a website like google meet from scratch using WebRTC, socket io & Javascript.",Km Habib,4.6,22,8.5 total hours,56,All Levels,149000,Hot & new
Google Fonts - Basics,Everything you need to know about Google Fonts - Basics,Learn Tech Plus,4.6,48,41 total mins,15,All Levels,149000,-
Angular 10 hands on for Java Developers,Expand your Java skills to become a full-stack developer with the Angular web framework,"Matt Greencroft, Virtual Pair Programmers",4.6,317,18.5 total hours,216,Intermediate,149000,-
JavaScript - The complete guide in 2021,"Learn JavaScript from scratch with examples, tips, modern challenges and more - Part I",Nico @softcademy,4.6,8,4.5 total hours,46,All Levels,149000,New
Complete Portfolio Website Step-by-Step [ Web Development ],"Responsive Portfolio Website Using [ Html , Css , JavaScript ] Works on Desktop, Laptop , Tablets , Mobiles , Smart TV's",B Praveen Kumar,4.6,151,3 total hours,26,All Levels,149000,-
Build a Photo Blog with Ruby on Rails,Learn how to build a robust Ruby on Rails photo uploading and management application in this project based course.,Jordan Hudgens,4.6,57,1.5 total hours,21,Intermediate,149000,-
"Laravel Payment Integration with Braintree, Stripe & PayPal","Advanced payment integration of Braintree, Stripe and PayPal Express using Laravel 8.",Mark Lengyel,4.6,18,11 total hours,77,Intermediate,149000,-
The Complete ReactJS: Beginner to Advanced (2021),An easy to follow code-along course for absolute beginners and candidates preparing for Tech Interviews.,James Maxwell,4.6,6,4 total hours,39,All Levels,149000,New
"Create a Twitter Social Network Clone From Scratch PHP,MySQL","Create or Build Twitter & Learn PHP, OOP and MySQL even Javascript by building your own PHP Social Networking Website",Aizaz dinho,4.6,357,12 total hours,91,All Levels,149000,-
Learn how to build Amazon website using Vue.js and Node.js,"Use Vue.js, Nuxt.js , Node.js, MongoDB, Stripe, Algolia and AWS to clone an actual Amazon website",Naufal Yahaya,4.6,193,9.5 total hours,103,All Levels,149000,-
JavaScript Bootcamp - Build Real World Applications,JavaScript from basic to advanced level. Project - based JavaScript course. JavaScript ES6 guide. Including JSON & AJAX,"Code And Create, George Lomidze, Lasha Nozadze",4.6,1198,16.5 total hours,120,All Levels,149000,-
Fullstack Web Development for Beginners :15 Hand-On-Projects,"Learn all the Web Development Technologies like HTML , CSS , Bootstrap , Javascript , ES6 , React , Node , Mongo DB",K.Sathyaprakash Reddy,4.6,41,36 total hours,195,Beginner,149000,-
Django 3 - Python Backend Web Development For Beginner,In This Course You Will Learn Django From Beginning To End By Create 3 Different Most Interactive Projects.,Kazi Ariyan,4.6,156,40.5 total hours,180,Beginner,149000,-
Webflow For Beginners: How To Use Webflow,Learn how to develop websites using Webflow in this masterclass course specifically created for Webflow beginners.,Sam Harrison,4.6,78,5 total hours,36,Beginner,149000,Bestseller
React Native: React Native with Hooks and Context,Learn React Hooks and Context with my React Hooks and Context course and leverage your web skill set,"Oak Academy, Muhammet Gokturk",4.6,7,4 total hours,28,All Levels,149000,-
Create a Client Network by Hosting WordPress Sites,"Reduce cost by building your own servers, automate daily backups, and more.",TJ Nevis,4.6,15,1 total hour,17,Intermediate,149000,-
React Beginner Challenges - 25 Debugging Exercises,"Never get stuck on bugs again! Master debugging and 25 scenarios with React, Redux, Material-UI, React-Select and more!",react.school _,4.6,18,5.5 total hours,46,Beginner,149000,-
Build a Backend REST API with Python & Django - Advanced,"Create an advanced REST API with Python, Django REST Framework and Docker using Test Driven Development (TDD)","Mark Winterbottom, Brooke Rutherford",4.6,4422,8 total hours,79,Intermediate,149000,Bestseller
Master Laravel & Create High-Level Applications with Laravel,Become a Laravel expert creating an eShop from scratch practicing all the Laravel features you learn in the process.,"JuanD MeGon, ProgramarYa By JuanDMeGon",4.6,117,16.5 total hours,105,All Levels,149000,-
Blazor WebAssembly Full Stack Bootcamp with .NET 5,"Build an online browser game from scratch using Blazor WebAssembly, Web API, Entity Framework & SQL Server with .NET 5.",Patrick God,4.6,287,17.5 total hours,211,All Levels,149000,-
Angular 10 Course: Build Angular Apps (Step by Step),Get started to build and development Interactive Web apps with Google's very own JavaScript framework Angular 10,Fatah Gabrial,4.6,434,1 total hour,22,All Levels,149000,-
Vuetify: Create an App with Vue JS & Vuex - in 5 Hours!,"Create a Gorgeous Todo App with Vuetify, Vue JS & Vuex - using many different Vuetify Components!",Danny Connell,4.6,290,5.5 total hours,120,All Levels,149000,-
Web Development with New Framework,"Aurelia is a JavaScript client framework for web, mobile and desktop.",SimpliCode Point,4.6,31,26 total hours,211,All Levels,149000,-
Node JS Create a Restful API for beginners JavaScript jQuery,For beginners learn to setup a Restful API that can send AJAX requests to the node server backend from jQuery frontend,Laurence Svekis,4.6,48,3 total hours,28,Beginner,149000,-
CSS Grid - Build Modern Real World websites fast (+projects),Learn all the CSS Grid concepts and create professional responsive website designs - multiple website layout projects,DigiFisk (Programming is fun),4.6,36,4.5 total hours,53,Intermediate,149000,-
Learn WCF And Web APIs From Scratch,Learn how to develop services using WCF and Web APIs.,Manzoor Ahmed,4.6,1550,10.5 total hours,83,Intermediate,149000,Bestseller
Build a Professional E-Commerce Website for your Business,"Register a domain, set up web hosting, set up email, and build a website",Michael Harrison,4.6,12,1.5 total hours,17,Beginner,149000,Highest rated
Web GIS development 2021,Spatial data visualization for better understanding,Tek Bahadur Kshetri,4.6,49,4 total hours,37,Beginner,149000,Highest rated
"Command Line, NPM, Babel 6 and Webpack 3 Crash Course",Master front-end tools modern JavaScript Apps need,OnlyKiosk Tech,4.6,37,2 total hours,24,Beginner,149000,-
Intro to Augmented Reality on the Web: WebXR and Three.js,Learn how to code and run augmented reality WebXR experiences on iOS and Android,WebXR Academy,4.6,44,2.5 total hours,28,All Levels,149000,-
"Modern Web Bootcamp, Design with PHP, SASS, CSS-GRID & FLEX","Design Stunning Websites With Sass, PHP, CSS-GRID , Flex and Bootstrap . Learn how to use Node js, NPM and PHP",Rick Sekuloski,4.6,18,26 total hours,118,All Levels,149000,-
"Complete React Developer in 2021 (w/ Redux, Hooks, GraphQL)","Become a Senior React Developer! Build a massive E-commerce app with Redux, Hooks, GraphQL, ContextAPI, Stripe, Firebase","Andrei Neagoie, Yihua Zhang",4.6,15839,42 total hours,376,All Levels,199000,-
The Complete Developers Guide to MongoDB,Master MongoDB and Mongoose design with a test-driven approach,Stephen Grider,4.6,6490,13.5 total hours,130,All Levels,149000,-
SPRING 5 (Covers Annotation & XML Config) + Hibernate,"A beginners course for Java Web Developers using Spring Framework 4 & 5, Covers Annotations and XML Config.","StudyEasy Organisation, Chaand Sheikh",4.6,164,23 total hours,238,Intermediate,149000,-
11 JavaScript Features Critical to Understand,Important JavaScript Concept and Features Every Developer Should Know,Steven Hancock,4.6,173,2.5 total hours,17,All Levels,149000,-
"React and Deno.js Authentication, Forgot and Reset Password","Deno APIs, React Hooks, Typescript, MySQL, Migrations, Send Emails",Antonio Papa,4.6,12,2.5 total hours,31,Beginner,149000,-
"JQuery Master, build awesome websites, 5 Projects included!","Learn Jquery from the scratch or learn more about it, and build your own applications.",Coding Revolution,4.6,215,8.5 total hours,87,Beginner,149000,-
AJAX Tester Application XHR Fetch jQuery Axios,Build an AJAX GET and POST request sending testing web application from scratch using JavaScript,Laurence Svekis,4.6,10,1 total hour,15,Beginner,149000,-
CodeIgniter 4: Build a Complete Web Application from Scratch,Learn how to build fully-featured web applications with the most popular lightweight PHP MVC framework,Dave Hollingworth,4.6,246,10 total hours,167,All Levels,149000,Bestseller
Learn ES6 : The Modern Approach of Javascript,Javascript: We will help you dive into the latest changes made to the JavaScript programming language with ES6.,Piyush Srivastava,4.6,14,5.5 total hours,52,All Levels,149000,-
Client-Side Data Storage Ultimate Guide,"JavaScript, HTML5, Cookies, WebStorage, LocalStorage, SessionStorage, IndexedDB, WebSQL and more",Alperen Talaslıoğlu,4.6,99,7.5 total hours,62,All Levels,149000,-
Learn WordPress Step by Step Guide Tutorial for Beginners,You've got a new site: huzzah! Whether you're a WordPress beginneri with no experience learn with simple method teaching,Harish Pagunta,4.6,71,4 total hours,33,Beginner,159000,-
"Complete Vue Mastery 2021 (w/ Vuex, Composition API, Router)",Ultimate guide to Vue 3 Development! Build large scale applications and deploy to production. Go from Zero To Mastery!,"Andrei Neagoie, Luis Ramirez Jr",4.6,414,30.5 total hours,296,All Levels,149000,-
Develop a perfect ORM like Laravel Eloquent,Develop a powerful object relational mapping system like Laravel Eloquent in PHP,Danial Mohamadnejad,4.6,3,6.5 total hours,48,All Levels,149000,-
Learn how to get your own website quickly,Learn the best ways to get a website quickly how to create your own website an get online in minutes,Laurence Svekis,4.6,17,1.5 total hours,16,Beginner,149000,Highest rated
Pass The Certified Blockchain Developer Exam - Ethereum CBDE,Want To Become A Certified Ethereum Blockchain Developer? Do This Course To Prepare For The Blockchain Accreditation!,"Thomas Wiesner, Ravinder Deol, Buidl School",4.6,206,5 total hours,63,All Levels,149000,Bestseller
"MERN Stack : React ,Redux ,Node ,Mongo - Pizza Delivery App","Build a Complete MERN Pizza Delivery application from scratch with React , Node , Express",K.Sathyaprakash Reddy,4.6,29,10.5 total hours,51,Intermediate,149000,-
Hands on With Docker & Docker Compose From a Docker Captain,"v19.03. Everything you need to build, run and compose Docker containers so you can start using Docker for your web apps.","Nick Janetakis, Docker Captain Program",4.6,625,5 total hours,51,Beginner,149000,-
jQuery and Ajax from Basic to Advanced,Learn jQuery and Ajax - Every module feature demonstrated with real-time examples,Sandeep Soni,4.6,12,5 total hours,16,Beginner,159000,-
Fashion Blogs - How to Start a WordPress Fashion Blog 2019,Fashion blogs are the latest craze on the internet today. Discover how to start a fashion blog of your own today.,Zac Johnson,4.6,66,2.5 total hours,17,Beginner,149000,Highest rated
"Complete Web Development Course: HTML, Vue.js, PHP, MySQL","HTML5, CSS3, JavaScript, jQuery, VueJS, AJAX, PHP, CLI, NPM, Babel, Webpack, MySQL, OOP, Node.js and Express.js",OnlyKiosk Tech,4.6,1116,32.5 total hours,600,All Levels,149000,-
Learn To Build Beautiful HTML5 And CSS3 Websites In 1 Month,"The fastest way to learn HTML5/CSS3 & how to build websites that wow. Great for designers, entrepreneurs, & beginners!",Ryan Bonhardt,4.6,567,11 total hours,80,All Levels,149000,-
"Learn Flask, A web Development Framework of Python",Advanced Website Development using Flask,Data Scientist,4.6,52,14 total hours,35,All Levels,149000,-
Gutenberg Blocks for WordPress and React Developers,Use Your ReactJS and Redux Knowledge to Create Complex Gutenberg Blocks and Plugins from scratch.,Ali Alaa,4.6,354,11.5 total hours,120,Expert,149000,Bestseller
Bash Shell Scripting: Crash Course For Beginners,"Learn Bash Shell Scripting from total beginner:Start from the Command Line,finish with a real world Shell Script Project",Francesco Santi,4.6,3343,"Learn Bash Shell Scripting from total beginner:Start from the Command Line,finish with a real world Shell Script Project",75,All Levels,199000,Highest rated
"Create Modern Website Using HTML, CSS And Bootstrap","Learn modern web design with HTML, CSS and Bootstrap step-by-step with 8 real world web development projects",Easy Tutorials,4.6,256,12.5 total hours,76,All Levels,149000,-
Isomorphic JavaScript with MEVN Stack,"Build powerful web applications using MongoDB, Express.JS, Vue.JS and Node.js",Packt Publishing,4.6,44,3 total hours,35,Intermediate,149000,-
Serverless React with AWS Amplify - The Complete Guide,"Build full-stack React apps faster than ever, which scale to millions of users, and run entirely in the cloud!",Reed Barger,4.6,1094,8.5 total hours,61,All Levels,149000,Highest rated
Complete Vuejs Course: Vue.js + Nuxt.js + PHP + Express.js,"VueJS, Command Line, Babel, NPM, Webpack, Vue JS CLI, Vue.js Router, VueX, Axios, iView, Express.js, Nuxt.js",OnlyKiosk Tech,4.6,549,18 total hours,289,All Levels,149000,-
Strongly Typed Next.js,"Create a full stack web application with Next.js, TypeScript and GraphQL",Michael Stromer,4.6,72,6.5 total hours,92,All Levels,149000,-
