name,description,instructor,rating,reviews,total_hours,num_of_lectures,difficulty,price,badge
Web APIs JavaScript Fetch getting JSON data Fun with APIs,Explore how to connect to various web APIs using JavaScript fetch. Use the returned data JSON data within you Code.,Laurence Svekis,4.7,57,3 total hours,45,All Levels,149000,-
React node contact form with nodemailer,"Learm how to create a full stack dynamic contact form with react.js, node.js, express and nodemailer!",Odysseas kolas,4.7,2,5 total hours,25,Intermediate,149000,-
RxJS 7 and Observables: Introduction,Learn how Observables work and behave in an easy to understand step-by-step way!,Jurek Wozniak,4.7,137,5.5 total hours,69,All Levels,149000,Bestseller
HTML5 Canvas Projects,Learn HTML5 Canvas by Doing,"ITPro TV, Justin Dennison",4.7,5,15.5 total hours,38,Intermediate,149000,-
Essential Web Developer and SQL Skills For Beginners,Learn Practical Skills Used By Professionals,Bluelime Learning Solutions,4.7,46,17 total hours,161,Beginner,149000,-
React and Laravel Authentication: Forgot and Reset Password,"Learn PHP 8, Laravel 8, React Hooks, Laravel Sanctum, Send Emails with Mailhog, Typescript",Antonio Papa,4.7,28,2 total hours,29,Beginner,149000,-
How to create a block for Moodle using PHP,"Step by step, detailed instructions taking you through the complete process from zero code to functioning block.",Chris Richter,4.7,2,1.5 total hours,15,Intermediate,149000,-
Working with React and Go (Golang),"Learn how to build a single page application in React, with data supplied by a Go back end REST API",Trevor Sawler,4.7,103,12 total hours,116,Intermediate,149000,-
HTML and CSS for beginners,Follow these step-by-step tutorials to master HTML and CSS.,Ernest Jones,4.7,67,7.5 total hours,114,Beginner,149000,-
PHP Essential How to create build Amazing websites with PHP,Learn the foundations and features of why PHP code is so popular through this series of clear easy to follow lessons,Laurence Svekis,4.7,94,3.5 total hours,44,Beginner,149000,-
Advanced Shopify Theme Development: Liquid + Vue.js (v3.0),"Learn to build Shopify themes using Liquid, JavaScript, and Vue.js v3.0 from scratch. No experience required!",Working With Shopify,4.7,19,6.5 total hours,33,Intermediate,149000,-
Object Oriented PHP & MVC,Build a custom object oriented PHP MVC framework and then build an application with it,Brad Traversy,4.7,3899,6.5 total hours,44,Intermediate,149000,-
"Image Slider in HTML5, CSS3, JQuery 2021","In 2021 Learn how to create an awesome image slider in HTML5, CSS3 and JQUERY","Usman Raoof, Fahad Chaudhry",4.7,14,3 total hours,22,All Levels,149000,-
JavaScript Master Class - Build your own React from scratch,Take your existing JavaScript Knowledge to the next level by coding your own React/ReactJS like library from scratch,Rajesh Pillai,4.7,48,7.5 total hours,55,Intermediate,149000,-
ASP.NET Core 3.1 - Build Hands-On Web Projects,"Learn the Concepts and Create Real Life Razor Pages, Web API and MVC CRUD Applications Using ASP.NET Core 3.1",Kaushik Roy Chowdhury,4.7,8,11.5 total hours,77,All Levels,149000,-
Object Orientation in PHP,"Fully understand object oriented analysis, design and programming from the ground up.",Lawrence Turton,4.7,259,5 total hours,30,Beginner,149000,-
Salesforce Development Master Training for Beginners,Learn Salesforce Development from scratch and become the Master of Salesforce Development with Shrey Sharma,Shrey Sharma,4.7,3,22 total hours,154,Beginner,149000,-
Spring Boot E-Commerce Ultimate Course,"Learn to Build a Real-life Shopping Webapp using Java Spring Boot, Thymeleaf, Bootstrap, jQuery and HTML",Nam Ha Minh,4.7,287,67.5 total hours,241,All Levels,149000,-
"AWS & Typescript Masterclass - CDK, Serverless, React","Code with AWS and Typescript by creating serverless projects with CDK, CloudFormation, Cognito, Lambda and AWS Amplify",Alex Horea,4.7,34,12.5 total hours,124,Intermediate,149000,Highest rated
The Divi WordPress Theme for Beginners,"Let's build a beautiful, responsive website together - without coding!",David Sharkey,4.7,374,4 total hours,33,All Levels,149000,Highest rated
"Node.js, Express, MongoDB & More: The Complete Bootcamp 2021","Master Node by building a real-world RESTful API and web app (with authentication, Node.js security, payments & more)",Jonas Schmedtmann,4.7,8269,42 total hours,228,All Levels,349000,-
Enterprise OAuth 2.0 and OpenID Connect for Developers,Master OAuth2/OpenID Connect with Okta/Google Authorization Server and Postman. 3 Java/Angular projects (Optional),Viraj Shetty,4.7,280,9.5 total hours,74,Intermediate,149000,-
Learn Web Scraping with NodeJs in 2021 - The Crash Course,"Learn and be great at Web Scraping with NodeJs and tools like: Puppeteer by Google, Request, Cheerio, NightmareJs.",Grohs Fabian,4.7,426,7 total hours,50,Beginner,149000,-
Make Your Own Custom Block in Moodle,Your first step in Moodle and PHP development,Brian Kremer,4.7,72,2 total hours,18,Beginner,149000,Highest rated
Create An Affiliate Marketing Website With WordPress | 2020,Create an affiliate marketing website and start earning commissions online!,Darrel Wilson,4.7,6,3 total hours,22,Beginner,149000,-
Become a WordPress Developer: Unlocking Power With Code,"Learn PHP, JavaScript, WordPress theming & the WP REST API to Create Custom & Interactive WordPress Websites",Brad Schiff,4.7,15646,35.5 total hours,161,All Levels,149000,Bestseller
The Complete Nodejs MySQL Login System,Learn how to work with Nodejs and MySQL together,Telmo Sampaio,4.7,41,3.5 total hours,11,Intermediate,149000,-
React: 3 Steps to Master React with Redux for Beginners,Learn React with Redux like a Pro! Start from the basics & go all the way to creating your own interactive React webapps,"Dr. Chris Mall • 25,000+ Students Worldwide",4.7,17,5.5 total hours,52,All Levels,149000,-
Angular Core Deep Dive (with FREE E-Book),Updated to Angular 12: Learn Angular Core in Depth - from Beginner to Advanced,Angular University,4.7,904,9 total hours,75,All Levels,149000,-
"The Modern Flexbox, Grid, Sass & Animations Developer Course","Become Legendary in CSS Flexbox, CSS Grid, Sass and Advanced CSS Animations by Building Awesome Real-world WEBSITES",Muslim Helalee,4.7,260,48.5 total hours,174,Intermediate,149000,Bestseller
NestJS Zero to Hero - Modern TypeScript Back-end Development,Develop and deploy enterprise back-end applications following best practices using Node.js and TypeScript,Ariel Weinberger,4.7,6089,9 total hours,136,All Levels,149000,-
React & TypeScript Chrome Extension Development [2021],"Learn Google Chrome Extension development using modern web frameworks. JavaScript, React, TypeScript, Webpack and more!",Jason Xian,4.7,106,9 total hours,83,All Levels,149000,Bestseller
Laravel with Vue.js - Fullstack Web Development (2020),Learn how to combine Laravel PHP Framework & Vue.js to build powerful API and Single Page Application (SPA) from scratch,Eding Muhamad Saprudin,4.7,665,30.5 total hours,227,All Levels,149000,-
Full Stack Web Development Crash Course with PHP in 7 Hours,Crash Course | Step by Step | Learn by Doing and Become a Full Stack Developer & Learn Full Stack Web Development in PHP,ZEESHAN ARSHAD,4.7,31,7 total hours,80,Beginner,149000,-
"Vue - The Complete Guide (w/ Router, Vuex, Composition API)",Vue.js is an awesome JavaScript Framework for building Frontend Applications! VueJS mixes the Best of Angular + React!,Maximilian Schwarzmüller,4.7,48836,49 total hours,670,All Levels,149000,Bestseller
The Complete Junior to Senior Web Developer Roadmap (2021),Go from Junior Developer to Senior Developer. Learn all the technical skills Senior Web Developers know!,Andrei Neagoie,4.7,6622,36.5 total hours,428,Intermediate,349000,-
React and Typescript: Build a Portfolio Project,Expand your portfolio of projects by building a complex app with the latest web technologies.,Stephen Grider,4.7,1748,29.5 total hours,390,All Levels,149000,-
Build a Cryptocurrency News Site With Ruby on Rails,Pull Crypto News From An API and Build A Website With Ruby on Rails!,John Elder,4.7,46,2.5 total hours,32,Beginner,149000,-
Javascript Tutorial and Projects Course,Learn Javascript by Building Many Interesting Projects,John Smilga,4.7,2009,40 total hours,357,All Levels,149000,-
Gatsby JS & Shopify: Gatsby ecommerce sites [Gatsby 2021],Gatsby e-commerce stack - Use Gatsby JS & Shopify lite to build Gatsby ecommerce stores (with dynamic cart & checkout!),Tom Phillips,4.7,152,6 total hours,62,All Levels,149000,-
Mobile and Web Development with React JS & Native & Angular,"Dive into web and mobile development, become developer with ReactJS, React Native, React Router, Hooks and Angular.",Oak Academy,4.7,18,32.5 total hours,292,All Levels,149000,-
Blog Creation using WordPress,Blogging using WordPress,Mahesh Sanghavi,4.7,16,1.5 total hours,10,Beginner,149000,-
Beginner to Advanced HTML5 and CSS3 (2021),An easy to follow code-along course to master HTML5 & CSS3 and a lot more,James Maxwell,4.7,27,11.5 total hours,102,All Levels,149000,-
The Hybrid Retainer: Escape the Feast & Famine Cycle,Escape the cycle of Feast and Famine with retainers your clients can't resist,Rob Howard,4.7,7,4.5 total hours,9,All Levels,149000,-
Signup And Login System In CodeIgniter 4,Learn how to create/design the registration system in Codeigniter,Shakzee Arain,4.7,5,1.5 total hours,10,All Levels,149000,-
The CSS Flexbox Guide: Build 5 Real Flexible Projects!,Learn CSS Flexbox & Build 5 real world responsvie layouts using CSS3 Flexbox!,Irfan Dayan,4.7,27,5.5 total hours,35,All Levels,149000,-
PHP for Beginners 2021: all PHP code used is fully explained,PHP for Beginners: Learn to Code in PHP. Every line of code explained in detail. A true PHP for Beginners Course 2021,Patrick Morrow,4.7,1080,7.5 total hours,149,Beginner,149000,-
The Complete JavaScript Course 2021: From Zero to Expert!,"The modern JavaScript course for everyone! Master JavaScript with projects, challenges and theory. Many courses in one!",Jonas Schmedtmann,4.7,113478,68.5 total hours,314,All Levels,149000,Bestseller
Node with React: Fullstack Web Development,"Build and deploy fullstack web apps with NodeJS, React, Redux, Express, and MongoDB.",Stephen Grider,4.7,13463,26 total hours,213,All Levels,229000,-
React Js A-Z With Laravel - For Beginner to Advanced Level,Learn React.js for Frontend and Use Laravel for Backend. Become Full Stack Web Developer By Build Complete Project,"easy Learning, Kazi Ariyan",4.7,38,60.5 total hours,343,Beginner,149000,Hot & new
"Gatsby JS, Contentful & Gatsby Cloud (Gatsby JS V3 2021)",Use Gatsby JS to build rapid static sites with Contentful as a headless CMS and deploy your Gatsby site to Gatsby Cloud.,Tom Phillips,4.7,17,3.5 total hours,33,All Levels,149000,-
CSS Floating Layouts,Gain clarity and skill with CSS floats!,Stone River eLearning,4.7,24,2.5 total hours,25,Intermediate,149000,-
Build REST APIs with Django REST Framework and Python,"Learn Basics to Advanced Django REST Framework by building IMDB API Clone (JWT, Token, Throttling, Pagination, Testing)",Shubham Sarda,4.7,95,13 total hours,73,All Levels,149000,Highest rated
Build Laravel Applications fast using blueprint,Make your self more productive and make Laravel components creation very straightforward and clever,Hazem nassar,4.7,18,1 total hour,24,Intermediate,149000,New
Build Data Visualizations with D3.js & Firebase,"Learn how to use D3 (v5) & Firebase (Firestore) to create dynamic SVG data visualizations. Bar charts, pie charts...",The Net Ninja (Shaun Pelling),4.7,1381,10.5 total hours,107,All Levels,149000,Highest rated
React Styled Components Course 2021 (V5),Step by Step Learn Styled-Components,John Smilga,4.7,523,3 total hours,41,All Levels,149000,-
NodeJS - The Complete Web Developer Bootcamp 2021,"Build Real World Web Apps Using Node, Express, PostgreSQL, MongoDB and more...",Mohammad Azam,4.7,133,14.5 total hours,154,All Levels,149000,-
HTML & CSS Tutorial and Projects Course,Web Development for Absolute Beginners.Learn HTML5 and CSS3 from scratch. Build Amazing Real World Projects.,John Smilga,4.7,2374,36 total hours,385,All Levels,149000,-
"JavaScript and Ruby on Rails with React, Angular, and Vue","Make dynamic web apps with Rails and JavaScript, React, Angular, Vue, Yarn, Webpack and Semantic UI as front-end","Mashrur Hossain, Evgeny Rahman",4.7,328,23.5 total hours,302,All Levels,149000,-
"Quasar V1: Cross-Platform Apps (with Vue 2, Vuex & Firebase)","Use Quasar V1, Vue JS 2, Vuex & Firebase to build a Cross Platform App for Web, iOS, Android, Mac & Windows",Danny Connell,4.7,1684,15.5 total hours,260,All Levels,149000,-
Learn Javascript Web App Development -Build A Calculator App,"Javascript for Front End Web Development - Build Your Own Calculator App Using Javascript, HTML5 & CSS in an hour",DigiFisk (Programming is fun),4.7,102,4 total hours,35,All Levels,149000,-
Create a Drag & Drop File Uploader For Websites,Add a nicely designed drag and drop file uploader to any website including your own online learning platform!,Stone River eLearning,4.7,23,2 total hours,12,Intermediate,149000,-
The Complete JavaScript Bootcamp 2021 - Build Real Projects!,"Learn Modern JavaScript by building real-world Projects! JavaScript ES6+, OOP, Async JavaScript, Webpack and much more..",Ghulam Abbas,4.7,42,18 total hours,122,All Levels,149000,-
JavaScript: The Advanced Concepts (2021),Learn modern advanced JavaScript practices and be in the top 10% of JavaScript developers,Andrei Neagoie,4.7,8930,25 total hours,226,All Levels,149000,-
Build & Deploy Website From Scratch With Salesforce LWC OSS,Master LWC OSS with real world example,Salesforce troop,4.7,11,8 total hours,32,Beginner,149000,-
Learning Bootstrap 2 - A Course For Beginners,Learn How To Develop Using Bootstrap. A Comprehensive Guide For Web Developers,Infinite Skills,4.7,9,4 total hours,46,All Levels,149000,-
Building Cryptocurrencies with JavaScript,Complete web app solutions with a major JS development platform (Angular),Stone River eLearning,4.7,9,3 total hours,16,All Levels,149000,-
What is Redux? with Simple Analogy and Coding Practice,Writing Code for Redux Cycle,Tech CodingCamp,4.7,5,1 total hour,8,All Levels,149000,-
Angular Essentials: A Practical Guide,"Angular 10, Angular Animations, Typescript, Docker, Charts with c3.js(part of d3.js), Upload Images, Export CSV",Antonio Papa,4.7,18,3.5 total hours,39,Beginner,149000,-
Kids Coding - Beginner HTML,"Learn the life long, worth while and in demand skill of programming! Your kid could be the next Zuckerberg!",John Bura,4.7,203,1 total hour,19,Beginner,149000,-
"Python for Network Engineers: Netmiko, NAPALM, pyntc, Telnet",Program networks using Python. Learn network automation and programmability with this practical course (Cisco networks),"David Bombal, Experts with David Bombal",4.7,2131,14 total hours,176,Beginner,149000,-
Meteor and React for Realtime Apps,"Master the fundamentals of Meteor and React with this tutorial as you develop secure, dynamic apps",Stephen Grider,4.7,1944,9 total hours,111,All Levels,149000,Bestseller
100 Days of JavaScript,"Sharpen your JavaScript skills by building Amazing projects over the next 100 Days with HTML, CSS and JavaScript.",Ewomazino Akpareva,4.7,47,61 total hours,202,All Levels,149000,-
Server Side Rendering with React and Redux,"Build React, Redux, and React Router apps using Server Side Rendering (SSR), Isomorphic, and Universal JS techniques",Stephen Grider,4.7,3211,8 total hours,95,Intermediate,149000,-
Learn HTML5 and CSS3 and Build a Professional Website,"Begin learning HTML and CSS, the most important skill of programming and build a real world project!",Hira Mariam,4.7,97,4 total hours,25,Beginner,149000,-
The Perfect NGINX Server - CentOS Edition,The Absolute Beginners CentOS Course to Setting Up Multiple Blazingly Fast WordPress Sites Using NGINX,Andrew Eaton,4.7,157,10.5 total hours,101,Beginner,149000,-
JavaScript: Understanding the Weird Parts,"An advanced JavaScript course for everyone! Scope, closures, prototypes, 'this', build your own framework, and more.",Anthony Alicea,4.7,42251,11.5 total hours,85,All Levels,149000,-
Learn JavaScript: Full-Stack from Scratch,"Understand the JavaScript language itself, Node.js, MongoDB, The Web Browser and More To Create Meaningful Applications",Brad Schiff,4.7,3788,27.5 total hours,124,All Levels,149000,-
Modern JavaScript for Beginners Learn JavaScript ES6,Learn how to apply JavaScript to make your web content come to life - explore the core foundations of writing code,Laurence Svekis,4.7,109,2.5 total hours,64,Beginner,149000,-
Learn HTML and CSS from scratch,Take the first step in becoming a web developer by learning HTML and CSS and creating your first page template,Victor Simion,4.7,141,1 total hour,17,Beginner,149000,-
Learn Javascript Step By Step By Building Projects,"This course teaches the fundamentals of JavaScript, UI component, tips/tricks and also build a DOM based OO game",Rajesh Pillai,4.7,103,31.5 total hours,133,Beginner,149000,-
SignalR Mastery: Become a Pro in Real-Time Web Development,Lessons from a Microsoft MVP,Kevin Griffin,4.7,155,10 total hours,47,All Levels,149000,Bestseller
Chrome Extension Development: Build 3 Chrome Extensions,Learn the fundamentals of Chrome Extension development by building three interesting projects,Tim Finnigan,4.7,2,1 total hour,6,Beginner,149000,-
Practical Guide to learn MERN Stack - Version-01,"Build fullstack web applications with React.js, Node.js, Express.js & MongoDB (MERN) with this project-focused course.",Haider Malik,4.7,2,6 total hours,69,All Levels,149000,-
Mastering PYTHON WEB File handling,Learn all the concept of file handling covering all the important things with examples,Pranjal Srivastava,4.7,43,1 total hour,9,All Levels,149000,-
HTML and CSS Masterclass,Web development requires these skills. Learn HTML5 and CSS 3 as well as Bootstrap and XHTML!,"Tim Buchalka's Learn Programming Academy, Robert Gioia",4.7,151,10.5 total hours,181,All Levels,149000,-
Demystifying Parallax: Learn to Create Interactive Web Pages,"With JavaScript, HTML & CSS",Rich Armstrong,4.7,61,3 total hours,15,Intermediate,149000,-
Single-Page Application with ASP.NET & jQuery Hands-On,"Learn how to build a single-page application from start to finish with ASP.NET Web API 2, Entity Framework and jQuery.",Patrick God,4.7,564,3.5 total hours,50,Intermediate,149000,Highest rated
Create E-shop with .Net Core MVC (step by step project),Creating ASP .Net Core 3.0 Database Driven Web E-commerce shop using Entity Framework Core,Pavol Almasi,4.7,297,5.5 total hours,75,Beginner,149000,-
Fullstack GoLang React Insanity Volume 2,React Hooks frontend & GoLang REST / WebSockets Backend with new mongo-go-driver,Zach LaCourse,4.7,4,17 total hours,91,All Levels,149000,-
"Build an app with React, Redux and Firestore from scratch","Learn how to build a web app with React, Redux and Firestore from beginning to publishing",Neil Cummings,4.7,1548,23 total hours,224,Beginner,149000,-
SAS programing on Reports and Tables generating,"Create reports and tables using Proc Report, SAS Proc Tabulate, SAS Proc Print and SAS ODS",sharon cheng,4.7,97,5.5 total hours,53,All Levels,149000,-
"Master Laravel with GraphQL, Vue.js and Tailwind","Learn GraphQL in Laravel PHP Framework, how to build SPA using Vue.js & Tailwind, build 2 projects",Piotr Jura,4.7,133,18 total hours,121,All Levels,149000,-
HTML5 2019: HTML Authoring Certification Course,Learn HTML Authoring and Earn the HTML5 Specialist Certification,"Framework Tech Media, Mark Lassoff",4.7,151,3 total hours,19,Beginner,149000,-
Docker Masterclass: Hands-on DevOps™ for Developers,Learn Docker with hands-on coding exercises. Take your DevOps Skill to the next level. Complete Docker for DevOps Course,"Teach Apex Pro, Apex Education",4.7,17,9.5 total hours,48,Beginner,149000,-
Build modern responsive websites with HTML5 and CSS3,Create a responsive website as quickly as possible with the latest technologies. Enroll with this course now.,Bihan Mahadewa,4.7,207,8 total hours,56,All Levels,149000,-
Create Hotel Website with Online Booking & Reservation in WP,"Create a professional website for your hotel, motel or any property and accept booking and reservations with WordPress",Shashank Phatkure,4.7,52,3 total hours,39,All Levels,159000,-
Amazon Alexa Development: From Beginner to Intermediate,"Learn how to create and publish Alexa Skills, understand voice UI, and be comfortable with AWS and Alexa Skills Kit","Nicholas ""Techustler"" Ivanecky",4.7,381,3.5 total hours,65,All Levels,149000,-
Gatsby JS & Prismic: Build RAPID Gatsby sites | Gatsby 2021,Gatsby JS & Prismic - use Prismic headless CMS data in Gatsby to generate Gatsby static sites & deploy with Netlify,Tom Phillips,4.7,88,3 total hours,35,All Levels,149000,-
The Ultimate HTML Developer 2020 Edition,Learn HTML/HTML5 from scratch. Practice tasks and tests included. This is a beginner-friendly course!,Kalob Taulien,4.7,522,10 total hours,104,Beginner,149000,-
D3.js - the art of data visualization,Mastering data visualization with the D3 library,Marek Pilczuk,4.7,25,7.5 total hours,53,All Levels,149000,-
Django 2 for Beginners (Part 3) - Deployment on Heroku Cloud,"Deploying Django Web Application on Heroku Cloud Server - Learn about git, GitHub, Heroku, Heroku CLI & more!",Shubham Sarda,4.7,2,1 total hour,19,All Levels,149000,-
JavaScript: Under the Hood ( Beginner to Expert ),"Learn advanced JavaScript concepts such as Hoisting, Closures, Prototypal Inheritance, Async JS, etc. by visualization.",Harshit Agrawal,4.7,8,4.5 total hours,46,All Levels,149000,-
Build Enterprise Applications with Angular 2 (and Angular 4),"Firebase, Authentication, Ionic, Integration with ASP.NET Core, Performance Optimization, Redux and Unit Testing",Mosh Hamedani,4.7,1538,9.5 total hours,136,Intermediate,149000,-
The Complete Angular Material Course: Beginner to Advanced,Practical Guide for Building Angular Applications with Angular Material,Abdelalim Aboubakr,4.7,10,3 total hours,32,All Levels,149000,-
Accelerated ES6 JavaScript Training,Learn and Use the Future of JavaScript - Today!,Maximilian Schwarzmüller,4.7,4904,6 total hours,115,Intermediate,149000,-
"REST APIs & AJAX Operations Using Node, Express, and jQuery","Learn How to Create Basic REST APIs and Exchange Data Between Clients & Servers via AJAX Using Node, Express, and jQuery",Christian Hur,4.7,5,3.5 total hours,33,Beginner,149000,-
Bootstrap 3 Beginners: Create a Professional Landing Page,"Learn how to create a clean, modern & professional responsive landing page for your app, portfolio, business or blog!",Andy Clarke,4.7,339,2.5 total hours,55,Beginner,149000,-
Track Any HTML5 Content with Custom SCORM,Create and track any HTML5 content using the Rustici SCORM Driver,Jeff Batt,4.7,45,2 total hours,30,Intermediate,149000,-
Complete WordPress Developer Course - Plugins & Themes,"Learn how to develop WordPress themes and plugins. Includes WooCommerce, React and Gutenberg development.",Luis Ramirez Jr,4.7,1641,21.5 total hours,152,All Levels,149000,-
The essential guide to GraphQL + React,So you want to finally learn GraphQL and use it with your React apps ?. This is it.,Coding Revolution,4.7,57,30 total hours,166,All Levels,149000,-
HTML and CSS for Beginners - Web Design & Development,Html and CSS for beginners - Learn the power of creating your own website within 1 week!! Enroll now to Learn,Danial Pervaiz,4.7,58,4 total hours,27,All Levels,149000,-
Regular Expressions in Javascript - Master course + projects,Learn how to create simple to complicated regular expressions in Javascript with hands on examples & real world problems,DigiFisk (Programming is fun),4.7,17,5 total hours,45,All Levels,149000,-
CSS Animation Build 5 Projects,Learn and Become a Master of CSS Animations by building 5 Unique Projects,Telmo Sampaio,4.7,11,2.5 total hours,8,Intermediate,149000,-
Shopping Cart Website from Scratch Ecommerce,How to build a fully functional web storage shopping cart that integrates with Paypal. Step by step instruction webdev,Laurence Svekis,4.7,165,4 total hours,55,Beginner,149000,-
JavaScript Exercise - Tank Shooter Game from Scratch,Build a JavaScript Game from scratch using only JavaScript no libraries no canvas - DOM manipulation Practice exercise,Laurence Svekis,4.7,12,2.5 total hours,33,Beginner,149000,-
Spring Framework MasterClass - from basics to advanced,"Most comprehensive hands-on Spring training, covering very basics to very advanced topics with practical case studies.",Vinod Kumar Kayartaya,4.7,38,9 total hours,75,All Levels,149000,-
learn flutter web development frontend-backend,Learn to build websites with flutter web and build frontend with backend website,Mostafa developer,4.7,12,6.5 total hours,40,All Levels,429000,Highest rated
Crash Course: Fundamentals Of HTML & CSS From Scratch.,Learn The Fundamentals Of HTML & CSS From Scratch In This Beginners Step-By-Step Crash Course.,Tech Lemur,4.7,378,2 total hours,52,Beginner,149000,-
Understanding TypeScript - 2021 Edition,"Don't limit the Usage of TypeScript to Angular! Learn the Basics, its Features, Workflows and how to use it!",Maximilian Schwarzmüller,4.7,23999,15 total hours,197,All Levels,149000,Bestseller
HTML5 + CSS3 + Bootstrap: The Beginner Web Design Course,Quickly learn HTML5 and CSS3 + Bootstrap - the basics of Web Development - to design your own responsive websites.,"Phil Ebiner, Nick Walter, Video School",4.7,1309,8.5 total hours,82,Beginner,149000,-
CSS Transitions Complete Guide - Master CSS Transitions,"Learn how to use CSS Transition Durations, Transitions with Transforms, and Custom Transition Timing Functions",DevAscend by Evan,4.7,8,34 total mins,8,Beginner,149000,-
